{
  "$schema": "https://json-schema.org/draft/2020-12/schema",
  "additionalProperties": false,
  "properties": {
    "active_authority_id": {
      "pattern": "^[0-9a-f]{64}$",
      "type": "string"
    },
    "admissible_source_fact_set_hash": {
      "pattern": "^[0-9a-f]{64}$",
      "type": "string"
    },
    "authority_scope_id": {
      "pattern": "^[0-9a-f]{64}$",
      "type": "string"
    },
    "candidate_source_bundle_hashes": {
      "items": {
        "pattern": "^[0-9a-f]{64}$",
        "type": "string"
      },
      "type": "array"
    },
    "complete_candidate_relation_set_hash": {
      "pattern": "^[0-9a-f]{64}$",
      "type": "string"
    },
    "complete_candidate_universe_hash": {
      "pattern": "^[0-9a-f]{64}$",
      "type": "string"
    },
    "execution_manifest_id": {
      "pattern": "^[0-9a-f]{64}$",
      "type": "string"
    },
    "historical_output_denylist_hash": {
      "pattern": "^[0-9a-f]{64}$",
      "type": "string"
    },
    "input_status": {
      "const": "FROZEN_PREPARATION_ONLY"
    },
    "proposal_evidence_profile_hash": {
      "pattern": "^[0-9a-f]{64}$",
      "type": "string"
    },
    "proposal_input_bundle_id": {
      "anyOf": [
        {
          "pattern": "^[0-9a-f]{64}$",
          "type": "string"
        },
        {
          "const": null
        }
      ]
    },
    "raw_identity_hash": {
      "pattern": "^[0-9a-f]{64}$",
      "type": "string"
    },
    "raw_key": {
      "pattern": "^[0-9]+::S[0-9]{2}::A[0-9]{3}$",
      "type": "string"
    },
    "raw_source_bundle_hash": {
      "pattern": "^[0-9a-f]{64}$",
      "type": "string"
    },
    "schema": {
      "minLength": 1,
      "type": "string"
    },
    "source_class_fact_type_registry_id": {
      "pattern": "^[0-9a-f]{64}$",
      "type": "string"
    }
  },
  "required": [
    "schema",
    "authority_scope_id",
    "raw_key",
    "active_authority_id",
    "execution_manifest_id",
    "raw_identity_hash",
    "raw_source_bundle_hash",
    "complete_candidate_universe_hash",
    "complete_candidate_relation_set_hash",
    "candidate_source_bundle_hashes",
    "admissible_source_fact_set_hash",
    "proposal_evidence_profile_hash",
    "source_class_fact_type_registry_id",
    "historical_output_denylist_hash",
    "input_status",
    "proposal_input_bundle_id"
  ],
  "schema_id": "554baacdf0ab2e639457894725b301eca212c05fe6db7bd257989b954c14edc5",
  "title": "A2 proposer/verifier common input bundle",
  "type": "object"
}
