{
  "active_authority_id": "36831020b75a201420bd5cfce97a54ada12d44246f56a7812455bc21b99f9477",
  "admissible_source_fact_set_hash": "4f53cda18c2baa0c0354bb5f9a3ecbe5ed12ab4d8e11ba873c2f11161202b945",
  "authority_scope_id": "34551e904bafa71fb2fb6db33162e94ad41a08eca6c747d429c83760e09c1306",
  "candidate_source_bundle_hashes": [
    "3705483d894cd3f64c712af510bce1bece4ef56f5d95e1bea00b7dfb05509c3b",
    "35972062e7a1ca659cfa55f5e84b6f3d1249432ba47c8f7a2ee89714088930a5",
    "f1abc97e870d230d9e80965be45f0ae3b4bbd122a33418db2933ae447c912448",
    "73143a85ba76ec40f41860fdeb73bf099d1cde8d6075fe8d9f8f94a46552ade4",
    "c9f826fe02260de9980926ec5ad9f480637719f654ecb1a25a71f30986dffaaf",
    "23b3a57dd28fba21f32a0b36b90986b9eb4a4e1d7949a39a5ec61b02358cb327",
    "509072c391080ad8a46ff41fc3fd1d76c8265d949dba1b4db6dda0732be202f4",
    "4a0e850fd0fb166fa57f6a452b325e00017f13ffcc70a3055c7679726aa8035e",
    "bfa8be03443ac19e5fc313f281d20d35d3e2f8605ac23ba051827684e07e4310",
    "d9ad5a046d5d49d464051a2ebe95e632d2aa581467f3e0f195a39260cc6e0d17",
    "3d06304f133c598449fbb2f4542e189761fab785ba00f2e595b606ebae6ce83f",
    "3ba06965c7c76638b35574b8538c4f00f60a1b1f8ce450187c495e481c98ce1e",
    "380561455bf84a8d0dafc322f67e39f9f4301c909924b6f27bc276d07b4b0980",
    "c50318ec786a14f282a05559775fe05ccfe57cfae151fb7d4fc2c0879c8fd459",
    "c185e2762aca1ec96eea713c73b35eb6b9b6d6e2cd1c59765a52d11151727fdf",
    "9c85c1b08696f781bb425c9e99f08d7f2471b5597775d93fcda6ebfcfa74b7cf",
    "67552ee734e50abcfffb7a8ba5d60a52292b61fd8e072fc91a14346a96dbc75c",
    "319a2d43877588e71c749d70b8b17bf5fc39b1cf5e3a63b91c6dbc0d934f00f5",
    "7e0905f8b5505c7d9b9e40492ac08d90ab412a7ab48e666295dc42b2de5e0557",
    "0806fb5aacf75203e3be97b45a1e247a97f3d8b81f45ae7ed829c4bcf9fb951a",
    "b07d1f7b6b51848bfcc0212662a7a3e71bd8b14076d3c1570c2117c96c73fc17",
    "09297b07bba5fe7bcf24bfe4942ec05755ca7044fd39c15833f442582c554c6d",
    "dd76a8dfbfaab2e32b18ad18613b580db18a99ba1a0eda4072549ea2fd89ebac",
    "01546c49c0e4ef7fb5fcede63d01f64bde996c46949a8fd61a375237f7891e6b",
    "2b79865e1f92594bc6fd978f6d844ff4e1d6784727c82eb6ebcdc751c0ac4c66",
    "a8808a5b1aedb0bd24d87386a944bf4b1cde5fbe2dfa597e7f85c18b54f765a9",
    "982faa34f31d42365cdef83dc60ddb11e150a6f63956d20ffd11b624b2b7cf94",
    "f7098b300d1c8494ce195e7d06e57f5f46362d4733eb5d40921f6613c8f5f5b3",
    "6e669476de3b5f58114c78390836039d363e199831c60b321056c70820af7022",
    "5b12fffa9ae442d99c848e1f3d93f20ede9c9b9ab8c7134ecaa2b70e1e4b953e",
    "9ca9a880b9fda751b4d2db0a4a7b9b52105752be5e671d6bc55adc8f69a969f3",
    "b6bf564d922b38a17804c2bfe099d70935943d85dc6314df4e9413ed8a499729",
    "b068acf2f0bed10afc08d69d4619852659dec75347377ef7cbbb9e5d3ad29947",
    "2ccfd83bb4c52874d1ddc49b57febdfd7364f8af32dbd6b8351e32fefc27c769",
    "07215b8b22a0840c2ee747293898cab9acc2421efb117aececb5f88438415187",
    "0e29140aa14d6d1968e9e263f9f29999ac0303f1cf8290ad213684b4ac51ae17",
    "f8e66a62bb63716c47b8a5702b27e63b58aa4e2c13acd2d13978c3734f38e46a",
    "24cea5a2bf6cd2074cca91368948abad8335611127ac076e418c3f48fae574bf",
    "4cbd83dee6c88aaefb18e1a4e9d78b5adf31bd001ec71d1afddaf6fadd077e93",
    "a24f4a9b2fe97848c25cec1cf956ceaab21850bb45bec08db12ad3510b78fb83",
    "d25b566c29abc78b8a50f926600ad8f9cb831c03e85464c043592ece4a425af5",
    "4483116df9d1bd17dcd57420c1bc204152f0f2fe4b975706aa13b00c8e3061df",
    "d2176bec324f183e0e2c0a6d59043f9e8738c694e0bb109daec9ae8e3a16df1b",
    "521e63160975c3745ef23f4a9f77bf820efe0dcab254a20e6b5c3d4474154301",
    "ade73c27431409151e290ee84c0b5d49f7d861af6a2aba8eec1445b84021db2c",
    "388d98e619b5fd35d12354fe3662a65d8b6a676368397c019df0d14ecd134219",
    "60994fa502745e8bfbbac26bd92fb5297cc1107ebee14b19274cbcc3277ba6c4",
    "6b62c890c7daa314d1aa8878ce4f2f264c5dbdcf6530904c375bda61fc39cb88",
    "67517b7002da627106197cbaceb51e34a95a41105fd013a93e5efdc6c369236c",
    "b5a89ababf44ce097ae327376b87b750b9f28b77d35cd8e698494668e63a6a0f",
    "1c7b56c12ef82677ac1f3017872212fa8cec95e076c78325f9a1ca6e531fee62",
    "297f35c84fe7564705f539832df91da614b89b6ebfb533302f3cae13a33bc35e",
    "32ca5fb7ad8830e01f7537ce29d7d35094bed457c4103d0e3d5742026f63223c",
    "a8ed369916d18bcaef1ebab4402b71f1326159918296ed3135c557f456cecf30",
    "dedb1c07e74dfd63e0c30f0b62005e09d8d68a70727f06340cf715e51cfa9690",
    "e65287516c6ec8d54a3b87e1163c3cc05707c65c49c38b833dd0bdce200b65dc",
    "aa4e1d5e55c8713b61f71afd360e9a314adf351600bc9383dea12aae47ba3d69",
    "830d6e8e08dfdb3a36c3d2a44c3d6f94dfdc75765bc619c3531e1dcb92fec539",
    "3806880523b738c435d59c49d0f7b631ebd40895633fd2fabdb6d9f2f96182ad"
  ],
  "complete_candidate_relation_set_hash": "a05a0c49fa6cf9ca3341bcc9271afccf6160b86873162c254d13d8dad2037558",
  "complete_candidate_universe_hash": "99862cd3dd30af604f0d9936c786da6e0ca9ecc1eee82d1364997ae85075612a",
  "execution_manifest_id": "9a76ac35974fe15fcac5031dff26576ed4fedd28bdbb4aece6302f8a7515b589",
  "historical_output_denylist_hash": "f2f48a3142bf192c08cfa2bffbb722e0131bfd4a1ba55623caf5af72748b94c7",
  "input_status": "FROZEN_PREPARATION_ONLY",
  "proposal_evidence_profile_hash": "e24746c96c5f741cc35df8d992d93936911dd1de2ce7f1a0f00035cda3b33deb",
  "proposal_input_bundle_id": "f95aa35cd6653c7ed4df81ea7d40b80a0a21efffd83aa32771720e256fe3df12",
  "raw_identity_hash": "557c4bdd5b81639c3be969ceb5301ff6a1b9b87a02c18366dea006f3b0957839",
  "raw_key": "6000006::S12::A001",
  "raw_source_bundle_hash": "75d5f472a32693ea53d928383cf2b3a9da4ab1619579995ca9e3cca375173c6a",
  "schema": "PROPOSAL_INPUT_BUNDLE_CONTRACT_V1",
  "source_class_fact_type_registry_id": "8cef6206dfc3581c3e7b6358bde7a36e90f4ba99078176cc0e5aff4b238298a7"
}
