{
  "active_authority_id": "36831020b75a201420bd5cfce97a54ada12d44246f56a7812455bc21b99f9477",
  "admissible_source_fact_set_hash": "4f53cda18c2baa0c0354bb5f9a3ecbe5ed12ab4d8e11ba873c2f11161202b945",
  "authority_scope_id": "34551e904bafa71fb2fb6db33162e94ad41a08eca6c747d429c83760e09c1306",
  "candidate_source_bundle_hashes": [
    "11e3c8964ec42f0e88739b2cf557eb933896db785ce9b41e7d2531ea07058a77",
    "e51ab434490d027ee93122b61607c1cc1b49e8347b7a9e4f5f6925708eba3cae",
    "856be91fd594ab038b098346b12484da7025120814f4ed7f959016baaf038e37",
    "ea164729e8e80402d9668797b71345b3f1144968356ce8aa9002455d09408b30",
    "02261e1edc8907f728c173a546cd48506082f00d58051b89f7e07ca08be6dcb5",
    "cb3704f18e3c1548130ddfbbd8ac6885f8bf65b5c27be81901d25029ab2b412b",
    "6ae35330a17313e489a62c0371bacd9417b74c298f9e944383dbf2aa3b96c690",
    "19e00a76fc5069cd1df83eddb9049d63a0f8334bbf695118185bb518b02ad64b",
    "5fe199aad39e631ca320ef2c36f24b2e8558ac68334f84045d798986514bfb38",
    "f81a39a159db7bd572ebbfb29e14c5e9a8983a7906726b00132158cd45159569",
    "33dc27f4b546347d127d408ef9b288104eeac21fa4c72010955b733e2b6e4798",
    "d2c0e02c507eb372397c428457df06571298a5776cf3e332827fce4c95b3e0a9",
    "09fcfb9c4b5534cf17a8ef4849eaf0225e925f16d4b8ed2d6771d2567f656285",
    "05148f704efebbaa0a5b7f0cfdc947ff6839e0c8bb2ed6c8bab1a20aec1729b0",
    "a80cb7f17e07322b182b135d0be546a3006969a63adca416027b6efa9db36328",
    "10ada4708fc4a616602467693930670f81ee0f39c27a643ebb2d1e8071e54f23",
    "18db6a3a51370678a94d7053eeb52ccc662de3287d62f41a63f260c0ab28ee7a",
    "f2862c716ccce296c19ec155baa4cd00f5a09f6bdcad3dd577f6bd8b8890598e",
    "74235709ca32d5575f5e5e9b9c664f9393058e993bf73598d81e658de49e3225",
    "8fa88e52c8bc8faaa024297488a76307d35fc57a77f53c2df544433936284f69",
    "197793c7dc70f3e2e82145c100407f396454cee72097e6e2b02f48b90cd993e3",
    "1ac6db3fab05998741b61a231a8bb3f5e94f25d8e4c164aab3d9c4c24ade6b9e",
    "38c5b0cf4e0c21c41b3158ce72d52b68730f67026952ef7c70be156c6338055c",
    "902d25c8ec3fa21845adc5138b59929d0a09ad76a71f05e4d117a0da7f370149",
    "359d64a4d0c95ac000e2d75a6091f3a2f2927a28f51ee3911e97987fab2777e7",
    "05e0c8c5b82109a7d079a5422262d17a049e37230d5173aa265083f42695f030",
    "4c2f4ea6e2a37038db4b06c99d311ddff89dbf1ea7807304554bf1f27c3d437e",
    "a54e2e3aa260e0f43286e728ed99dcb5b60b7ac02e555cc3e8577d193dfb8c9c",
    "bd12be4c4b0d42cbbbb9cb4c519a8d7ee86a89de10b12c863b9e367c54d621d3",
    "9e5ac727ac6b680caa8d00c27de1bab0217d7525d2c54a6c451d0133f52d6163",
    "4af4ba2b995814980f9396ccbfdf595908831fc22c38d75b7f156a23e2101222",
    "4c873155c5c3d13b51c96d70435ea73536dc2cc12a8bc6aff35533606ae951df",
    "c94caf017c421a26c0aa68e11d041b85a8a7516f8653e73d5bf19d9aa895e6e0",
    "25d44cb122cd257acf983172526a493af994342011c17ee2afecbe9518c1f543",
    "a51d3939e3dc2c3b2764cad8502522baf3d003062cdcda60bebe97b9500a1833",
    "421b198200095ec09212d336cb89bbb53cbb16e2022c634026886037870828eb",
    "423a73b7ee897bdd5b23ec3c55682f94ca9f3dff05da27bddeba0772094ba3b4",
    "98bd132370cfdf3bd55cdbca94666fa32deafa8a21be29cb376b59bc7ec5fcbd",
    "904b2f2daaf6730283464828ad0b044fb6901e29c2417e2a633d7780dd218c49",
    "4fb82a3765a2fa6cca577e01bb5f1f7e4c9e43ba5ca7182f13696007d8d60923",
    "ceb2392a7c6362136611862f1c1afad73412814c77562cb78bf9ae53eab0a830",
    "45100bb0088bb55ed80763a6cad3c9e70196b1d7ab52f0145003a3e1eaa18e62",
    "c09f4d48b6878b71457b3140bbdd421db5318af7e9167fd6c9129baa1df67bb3",
    "eb3321e766bd07769d62818b54b7fedede74ccd64528f3cb8b0d4292ab974529",
    "b12545024c4fb1f6defeef14deb8d7dba5c2a6a67c31fb8d48a4fc9a4865f95d",
    "000d411c4a8963795f976067e5d1a790e11f52027b1c395e912d591b2b29d726",
    "cf9e05406f325496341c232bd86c423ef996c7e116d443264ddcb045e9a07d3d",
    "9e52c1389cdab25c8fa63dcb40fbe090126e761db34a62a3ef4c4c172df844d7",
    "19a02d7ce12c187e2e1021780702de919648401aaae6f36c87094ca0982c1f9f",
    "9f2e6d629e9669ad6c1ef12e89816a0584e4d475da14fc3102ee5bd4a4a9e0b2",
    "50ad9f521b360c76d39bea02da6f7577a2963896ee48336557c9213cacd8e08f",
    "d31ef9f9b9a803d0cef8b9b47c961ea28aaffd37acaf3dc853fe2a33e5a3753e",
    "ea4d32e2557c324022bafa372ed667a0f66fd524fce79c8baf3bbef8ee117766",
    "e9efd67e68823d959c16124b5a3d0d856dc97404d53955c2182e1793c02d0e9c",
    "169c28a5591a7f109c57a360211867857f82f1b1a2c24c5602825346d460fcbf",
    "003d89cce56a78525f90cd9985bc70812ad5ce536737bc01076b13002040c7b5",
    "a1214f62a502c30aff8ddd6c5a36fb37ddd4bcccb4d62e4b7f474e814f52e842",
    "10f5c43a86852c78ca8f5b485533440f08373b9c62a35c15ac45b8981dd67cfe",
    "6d1a295864189ad0c568625abf2adb8827997ef5ab3b08e14287877bb290ef86"
  ],
  "complete_candidate_relation_set_hash": "ca49d4ae7ed294be03ecfa8f18222e26e3f21ad11800d426d78a621e3be7f361",
  "complete_candidate_universe_hash": "89aeacc2b21cef989deb9454ef0fc4edb0aa0ddfe5c81d7fee99d7dd1cc52692",
  "execution_manifest_id": "9a76ac35974fe15fcac5031dff26576ed4fedd28bdbb4aece6302f8a7515b589",
  "historical_output_denylist_hash": "f2f48a3142bf192c08cfa2bffbb722e0131bfd4a1ba55623caf5af72748b94c7",
  "input_status": "FROZEN_PREPARATION_ONLY",
  "proposal_evidence_profile_hash": "e24746c96c5f741cc35df8d992d93936911dd1de2ce7f1a0f00035cda3b33deb",
  "proposal_input_bundle_id": "96948a449a29fcfa3a5787e0a51cf3ef94049b0463e0864b640cd6e395711454",
  "raw_identity_hash": "8e7bcdf4181250c188b3dd700f727b27844d46085acb3438ed1698411a6e7e3e",
  "raw_key": "6000006::S02::A002",
  "raw_source_bundle_hash": "8c58419d48e4e81b71ff09113a31e2ecf25d083b709b3161b17bde3ef6f85c77",
  "schema": "PROPOSAL_INPUT_BUNDLE_CONTRACT_V1",
  "source_class_fact_type_registry_id": "8cef6206dfc3581c3e7b6358bde7a36e90f4ba99078176cc0e5aff4b238298a7"
}
