{
  "active_authority_id": "36831020b75a201420bd5cfce97a54ada12d44246f56a7812455bc21b99f9477",
  "admissible_source_fact_set_hash": "4f53cda18c2baa0c0354bb5f9a3ecbe5ed12ab4d8e11ba873c2f11161202b945",
  "authority_scope_id": "34551e904bafa71fb2fb6db33162e94ad41a08eca6c747d429c83760e09c1306",
  "candidate_source_bundle_hashes": [
    "ac27c449a9142e06e055071dd05e71f4f36716d6a40d2eb53aac687e56a77087",
    "672489b247efc02fa0cab20c27f7ed39dea2bd8435e97ef2d08ba2003cd6707b",
    "72308571626a0382fcb6aeb394019e14f17047d5e0bb5557a84cd5b818cb9ecc",
    "a00a93baae6a0e9a90a65684c71b9a650549e72aff42b8bf202177ceb74dee11",
    "1b6e04de679028b74513d957bffd7fa5c1c110a021612725882d457e24ecc143",
    "be486d806b1206f7809b94328b1ca0b55323da8a9c4733e900218e8da6e9c149",
    "2d4e6de616d33dc8c8176b2e4c4bfe545ed86058502c4bfef689565c055d4fb5",
    "d0e77c3114699c0405aed1c0df180363c09411729b7488b09f7c1b35d5514107",
    "80a2cfedd3f2103197e4b2c70fd110799035ab096db84c460757d1a472ac6cf1",
    "704117597196fb2ff1f1003009690eac9e2cf0f08e406792d6e98d6509662529",
    "62aaf33d524b88b9100b0513e7845b6e96215a3a6f969b42b99bd2358d1acd55",
    "77a999f9da76d5af4af13ba4533eb544bb4db55e1bcd6d94cc142f35c11cda3e",
    "83e0add401e9b7a07d7af8d836ca51ab4be828b9a01674c0c3dcd7bc78acc874",
    "3d7108405dddf4ad640cf88579ce84149a6a80a58ebad46ac5cc8b0440d0efbf",
    "accfd12c140668dd13c3c1fe775627259266c03201d5f1c1ddd81cee66c6c60b",
    "1e95f0ce618a1f658f05c5a64707aaf3aeda6dc13f3ddadc1256788f8d3ad7f2",
    "f12acbb9156d0e85de81999dd4d0b603f14d96f52478d1e67bd955948796ce32",
    "257092d8ab647db171084a53379d63568e1bbcbaa42d40b2d60765644b65a5c8",
    "2f7be11ff66b7e94cf1545c58b5ea408429bf58eec34c36e0b47b394cc924261",
    "a73d0ea7bffc53f4b118e41995ffe7674beec73a7772b121b376a4f617fb1fec",
    "c688a10603dd426100e66067b79ea966dfc71b40783d12f1f2d9d90bb54af7a5",
    "22ee0cfb8db239fd419bab1795bacce7334fbf4ec2483f59571e567d854fd902",
    "804107061e206d152c49d88e46a72ac5fec768a770faf0ccbc6b1ac022540ce9",
    "65fac3d8c0aedded8b76cc41f143c816de7b2edf513f2fa66110e88ed497f825",
    "3a7957dce4fb1588db3c9a7c9151ebe2242c956b71806dda7432c25d3b1cef2b",
    "660c84229ba9ee96a2cb76ed669a30257a8b90d5f81391ab9d49339cfabaa2c3",
    "1b2e1287ccdc07eb1448775d0647e90b15e9b6eb01b0d7dd1e88feedd1daeceb",
    "54a2755499ce7de197299e927dae1c6aeba378e0c1d95aace2889298ffed0817",
    "465753dc80162a8b17aa7599cba35f06e58fc3a1749ffd9461877a4d4af2c505",
    "4e7ceb805097e8efbdec4912d4619c75a341bd27f43b4b9163ff2a25591e57d5",
    "ea2bd115a5b7e1709e63781d93495c005e72fd0e7e2dc2270321b7af46c75573",
    "fb927fe737864663395b8fa5fff541d95e0341b10e6bc1e9d7e4ab1360658e10",
    "e03c829efa19d1fc70fab850741d9bed730f46da8e1ed7795882cf3f462d694b",
    "d6b18450f9d285efd4fa08a06bad230a92de4f847dc6e4d575dec6f2770b976a",
    "f43a432523378ac531afd9b354a5e763f0903732d6bf9af5e4436556b59832d1",
    "24ab9913dd661dd50b61c80be70263017c4404773652d5930964d025fdc63599",
    "cee01e2ca9d967460ba90441a311f48222ad05bfcebdfdf482e66597dc7c2e51",
    "dc753b43a91e35a25ed647e00e8b5d2e1e69f851334694593e8dd863cece8808",
    "24f2daad066c144055a551c30b29cbcb7bbd145b1deb826d0ad557c1ba2e4ae5",
    "218aa1d857b346b75cf64cc7bc6aad3a50f40008b0ae333d36aa24db413a6b64",
    "2d58fa55d9090971f3e476f641b31dfa50cbd8978020d7a813851c9ad42f6625",
    "3c608d6e9441ad3b33b26dd50290726c4e0816295dc66c34f1e8699de601c0b2",
    "185371c167fb07077ba00edaa2e5d41613b06db416e6f6c8e49379a2620a81e1",
    "108ad76d14fb7ad36c71d1746951f4b38ca3660138412e431c6508f277b5c7f4"
  ],
  "complete_candidate_relation_set_hash": "8adc3542b5486eb21a74fb5a30e0bc9738936f6a5d62753bd62a7a158f241fac",
  "complete_candidate_universe_hash": "8896daf01d8c39208b1fac1c7acd17c1d13f1f807da043d9925542a25f929c47",
  "execution_manifest_id": "9a76ac35974fe15fcac5031dff26576ed4fedd28bdbb4aece6302f8a7515b589",
  "historical_output_denylist_hash": "f2f48a3142bf192c08cfa2bffbb722e0131bfd4a1ba55623caf5af72748b94c7",
  "input_status": "FROZEN_PREPARATION_ONLY",
  "proposal_evidence_profile_hash": "e24746c96c5f741cc35df8d992d93936911dd1de2ce7f1a0f00035cda3b33deb",
  "proposal_input_bundle_id": "3a6eaf08217fca93c95a84aa811ea33c3a751e40a10e4090185a9ef1bbf3527d",
  "raw_identity_hash": "4fe4bd098e9e62f8b7ee6df4135cfe61812374ab3a91c805133738ce3fd8d746",
  "raw_key": "6000002::S07::A003",
  "raw_source_bundle_hash": "adfca0ab67b83ad3be8f5ed45d9066f6442421bd3dffe0704e57cd28bdfa08dd",
  "schema": "PROPOSAL_INPUT_BUNDLE_CONTRACT_V1",
  "source_class_fact_type_registry_id": "8cef6206dfc3581c3e7b6358bde7a36e90f4ba99078176cc0e5aff4b238298a7"
}
