{
  "active_authority_id": "36831020b75a201420bd5cfce97a54ada12d44246f56a7812455bc21b99f9477",
  "admissible_source_fact_set_hash": "4f53cda18c2baa0c0354bb5f9a3ecbe5ed12ab4d8e11ba873c2f11161202b945",
  "authority_scope_id": "34551e904bafa71fb2fb6db33162e94ad41a08eca6c747d429c83760e09c1306",
  "candidate_source_bundle_hashes": [
    "950d66ad32d0e9358b747e0ed4fe254e605ad5896e920c76daca098934829d8a",
    "37232dd7b49c77bce85643a0cdccfb6e65241a7fd5589939506b19294e7fb08a",
    "68b685cf9562786e2e9ea4bf8abc545db1669e21ae04d4dcf23c6714dfa42883",
    "47fcb3afbd07439b435a87e7abdf027c57218b83ba460f096495eae6d6854571",
    "cbbee8ddac4ab3a464c5891117abb17e108170fe32993507b12300f94152de87",
    "09ac10380c8e0dc98597350d9baa7e0da68bac6e3e45cfc67c831cea503ebea3",
    "114b9ca974ba5c400f027c134592419df2bbc68d3ea44988acca54d9f79c3b5e",
    "b0a393ac122f7a324ab15cd27d96ff1274e279d50b23a1d34b33a03de2675ad1",
    "a65ead4cbaf1d718d1e5b94fe8a754d61888bd79c9d9f2123c53f6b3aa589a38",
    "d9c53b59d474fe0c853900591718d80c11da114d0ad919aafffbf111676aba88",
    "78e5f577b293ce452eb95e5138a9fbe10bf3dfa17527992fa05547b5a5ec587e",
    "280624eba2c1595cd387f8da395592450090dfb3efde5363d1db97ae0093f1cf",
    "4cce860ee35407582d0636ab7b3d7f4e7a1c65641f33c71f75000ad41de27e45",
    "8c7ca04340085ed108b633a1251758ac6aa9ecdab1d0b08a469fe474653ecdca",
    "1573d0bb3c109bbf65e938e0300a068fcf60b1c6ff4f3149c82a09c0512ac5ef",
    "71a54e3525561da12856e06e5f2ced1239bc0c959d404a71761e94aba9cc67c3",
    "cba587118c3596cd5d756549ca1755734f9860dfd1780d10dfd995ccb8d83f3c",
    "5245abe883137165958c0dd897f170b429cae481944c3b2253f028d5a88461e8",
    "a4e720031a103ca16b24ea8c266df2147a8b5441ece7bd3d3ccd6751cf4b6b4e",
    "53bae47558373f8fdf9983a2ed3db8d5897d8cdd2994b0d124c953301ff18b67",
    "3359b77ebd92a6d1edae1c194afc084245d96c2a204547b3f29f1bc1aa31ebe1",
    "dbe04298e841c028247981824c6b5ebb805a9f75210a7956916150a45d9aa7c5",
    "3f81a11274906cbc9fc052bcf9c684c65deb01a53df973c16db57342c534df20",
    "14fc3194a1d81d1f557a47cf96d61509be5cd56e9c784f4c6f7a7a410fb2f377",
    "a84511b1113221af8d9e815d212b4863f3fe39928ea4e52188cbe2a28952d338",
    "1f1d393aa34491ab0bc544bba261d0a3f6c099b831bb7f2b28155fd9cbbd8171",
    "0ad3e40d26e7c3fbbc32fc17559954ca39dab590f4efff6515ebaa71bdde42ac",
    "93642ef4d5fc7c65da911ffdbc91022b73940dd4cd8450f1aebadd15f19a40aa",
    "19753920e4cc5ff57974cb87bae6c9e4934f6fee421641f9786bdbe1979b0c7c",
    "bbac695886c03b896d0af616763185d51368c616853d07b62df4ea310ca56d96",
    "187d7fad319f2256062059bd4f23469c4c69cbf073d5fe67ffab690397d2b4e4",
    "52e89c57e6473eeaba2ef445682ba9d2f1b6009249c123f0fcde1d2268219b3d",
    "fc311b6097829e20462ba4aaaabdbf8109d16431e69ef9f6c5b400ef592e0a8b",
    "abe9ef4a5d05aed771083e903c34ba6a2f68f001dbbb33220b2aadae706190fb",
    "b838abaf6da78f1150d1bb1a42561810a92ebf0f43b5693260a4474a1d2d966c",
    "0e3db8441329b8f6bf5e29524324717e3a2f8b707e93a5432766374b9f33b5b1",
    "88997274225a07d252fe2ed82c975ff97e0a94ff5e9bc0204f696da5a65f9fe3",
    "46da1bfb3e0984cb29307d323bbf8ce67d166482e2da31396d3fafe2d4e932cd",
    "58cdd849c316564c9d726ce7a7fb90473d6983db07fa2ef077d464a48bcf2dd4",
    "888e2cefc96a151799a13963a0f74caf69217b23326c0174158f10f1a0d9755f",
    "cd5d595acc8f4464583b268af6a969f0bbd3a75dec8c23e8390c494d0ceda064",
    "c71be36da351178528c63430d2cb14f88e2a2298b0684fdd31d008863c5933b8",
    "dee9d45b55a0f496f8a113334c94d1a59cd2f472aa14d4bc68cae9c7e22fff8f",
    "725dcae3ace298f2a504ebc359e6b610d5313e034e7d43e311af5d54eb8fd9f1"
  ],
  "complete_candidate_relation_set_hash": "00d849e1f63c2ed721425ec13583c4055f99bb4e1d1c980be639e27af865e6a7",
  "complete_candidate_universe_hash": "34f4eddee895b0668909897b7a43c3410f8e626b5944ed7b29ab79f8ad181150",
  "execution_manifest_id": "9a76ac35974fe15fcac5031dff26576ed4fedd28bdbb4aece6302f8a7515b589",
  "historical_output_denylist_hash": "f2f48a3142bf192c08cfa2bffbb722e0131bfd4a1ba55623caf5af72748b94c7",
  "input_status": "FROZEN_PREPARATION_ONLY",
  "proposal_evidence_profile_hash": "e24746c96c5f741cc35df8d992d93936911dd1de2ce7f1a0f00035cda3b33deb",
  "proposal_input_bundle_id": "fe59055ab0b1e866ba6828a4103e7228796cc23d5c09c2c5bd04022c56d0eb90",
  "raw_identity_hash": "226f7855fb37f5f35345cc91cbeb3e7223747416ab47df7a756938795fa3fa7c",
  "raw_key": "6000002::S05::A004",
  "raw_source_bundle_hash": "39adf13c21e854a322c5cc4d515eccf01478594df2cbb168521cbf026c08d637",
  "schema": "PROPOSAL_INPUT_BUNDLE_CONTRACT_V1",
  "source_class_fact_type_registry_id": "8cef6206dfc3581c3e7b6358bde7a36e90f4ba99078176cc0e5aff4b238298a7"
}
