{
  "active_authority_id": "36831020b75a201420bd5cfce97a54ada12d44246f56a7812455bc21b99f9477",
  "admissible_source_fact_set_hash": "4f53cda18c2baa0c0354bb5f9a3ecbe5ed12ab4d8e11ba873c2f11161202b945",
  "authority_scope_id": "34551e904bafa71fb2fb6db33162e94ad41a08eca6c747d429c83760e09c1306",
  "candidate_source_bundle_hashes": [
    "77adc2172f385faaad889725b9eb756c88faf8a64ee26af1eb37ad1fce689e9f",
    "6a52214674dae327eb17047e30a2184fa177880d3f24ca7b47b25b7e6da45487",
    "4519f318ddab83e6240fc1911b5b1d4e1eaafaf8bf078012077c97f5208dd531",
    "14d7f63c92610f1090cffc9ecabe583a79d72a433d27f5a0bbfce73139397b90",
    "a7aa2b1a3d1b00f1239f26d5325e16d74a51e9d2977e1835149b727f283cb7bd",
    "a07bf491ae89a2c1ef7b0e8e0026486fc6bdbe3ea4fc1196a09d10b0c5d16002",
    "a947cad74fb568065061c6478599f6ec04d2f087ec055dc05b0db3cb459dedbb",
    "b10c17e92db6e18c64ef3a918fb27037136eea6c1f2bef7ca8b52b02960c9539",
    "6056ba6a53d3351d3deb38ed546d37dafb5da48ee4723621e3c5d51d94bfcbde",
    "bef5bc6d76d5c5ae6450436e32a1d3c52e1b6242913abbf151a5ff4a252dc012",
    "a15262dac438cd3a1cf85b05a2100c884dea9879cc4638972c599b3bc9dbf08c",
    "f02830db5949de94cf1b726cd79cce229d0a072c80dde26f45034bea967d64f5",
    "dd1411756eed80d6b422cf3a23ab8f90815a417c2c88d8af1a00a37cd0733ce6",
    "a25c484a05d71b29fb7967a1beb8046033d642ab649b691937cc42d0005ef0cc",
    "21f18f5931502fa1037d17bad2e96a5a623af4c4c7a70a592980a8a9d989a27f",
    "689affcd0f7a6657cf8aef1133bba349946bf78f283a8b78cf7e47f740352df3",
    "a48637c63ca3ab0bfd6f8f32bcc76d4c626dadc274b2e359a3430c4c296f3b30",
    "c55d35abbd2d4602da8bf288a9e6bb3e955b7cd07490e2b708840096c2b94065",
    "14997b3fbcd10357c9a981df97ab78a5154a8e6f01fa8b386b892eb885dc681e",
    "0edff2ef6b658ca463c5c0d71eaa2caa9908297050ef34220f9ee1265bc0630c",
    "effe4f08f46d9e955786ba3bc727d86a06b63fed7ca0df133d8e56246d2c92ca",
    "eaf80122f70ae9bfdc1d79508ce7aa0363d9f02469b4781d388b07ec2273d389",
    "5c66467441a2f44f899952685ef22f4be8ce873cde6cb86b9fef273483396114",
    "d096cac76572fcca1510afbd60319a7df70ccc0afb3303e4e78a7638196a8760",
    "38ed724cd8a70b4a89cf9a7dad9972b428f27eb4d1d1c43d95be97ee0c415b30",
    "6427edff69923958522c4dcf7929d573b342509800760c2ca8e4600ee8134426",
    "8fec3aca96dcad9d2785fb364f328787f610087566a1aa76a78fc080271c6178",
    "ec25eb9d817545343d125d6c33e0db3ed76367fbe4f2cadfc02f853b8bd98704",
    "04294ae83be124713672eb8958da6567c16ecd8be2d5fea932adfcea4fd2eb5c",
    "f8e6b93e6d24e525da8a6d5fe2f28f0594bfe98122304c8b25df15b76b1c6c23",
    "2f7e7479d1f7f0d79dff2af1e7475c91c8c829fc0b24f0e4c59992ad6086e74d",
    "16a2332cbd1a3a73142b43bc0b4fe3c051cc7cb848206c8d4e5c7d9ee661cd1a",
    "0b2be67e67a8d1e29a5ff37d154dd211f24b560c2a3f2b895fe55ccebcb6ac23",
    "4d3fca02c7f572c594fc67dd97e5e765eb0ecb5716afbf721fdd56533c877c3f",
    "4516af53ec282cbac9dd201f4a7dfb14c65b15b6db00977462b15e3de2919d5a",
    "efeaff25641793912197fb1ce32e9cfbad9c7e35230e7ec517fd07539e553e0c",
    "99934619dccb5c0d71d5eef3697ffde2de65012f1e5ca3584ba5dbe0cc5beac6",
    "2be04a1e50d2d5626d5f7d2d518dbe908dca967bb6a63fcefa27dca6a7bf1c96",
    "4829dc901e9b725e3a64d90ccd7d400e242a0e6937ddcfd3a251771a2fbf1ed7",
    "2fec4e0f8e2ccbb00a0f30f40e8e92cc66c55ee11554204a55c68e44d9406d7a",
    "91708342f734391197e98a126ca0f92381111a7d1c59fd904934003d51194660",
    "7f3512c78115007e08a2fabb7f642d92d9a47de64dd2a7fdba03865552a722e7",
    "a551018fcef6985e591e21659d23f8f808b727efd442c8f55219b1aa108e9583",
    "602f5035184a7bea6fd30ea3fd8f94d833821bd00bcf18d3123a6fa296359cbf",
    "6f07af1b736760081bacf9c155e959f8f7b849eed97c5cf22408564c659f8802",
    "60ca852de9b82a84732e8283fbcc320a45a503246612a3a8b4558781e29648f9",
    "78118489eacad82392e338d1a5ee136e48f45d8b3aded82896ed9281a9050b3a",
    "399d2822b9f19744a907144e72bb488f0898798422e5bcdbe739db348e15e9fb",
    "be88bde24be789ce913c97e8cf92f28f2ae3057edabe7a129ffbde9912922b05",
    "98085ca67af027ef0648faf5e8479e6324ec74eb4d0c7a10adfd6634cbf00cda",
    "0b691e7c573608bde8aa7c7572a961aaaab6a0f321385d554b577b0bec881008",
    "281ce738fbb8e7ce380e36cb1fb9582d318224b3928b6d4921716702f434cdd1",
    "4b36b614f8682746d06cf0ff4f2a008c73c2b953dbe0d8fd983e9f2b7fdf80f0",
    "825a07f35be95fb45748d8d783a4acbf9d44bd0da78a44e270765dc96482acc5",
    "ad475d28572c1f3ff30b175bdb7d94b651545fa951ff15a7df8897d2e9a3802d",
    "b3f3bd5b01e72b254aaaa69a3c0debc513479bb1c146ec6b41fc270d91fb37fb",
    "574b7af570da7daaf89904864a2e304d8344a6c3267fe1d4a4db1db9b4f73bb0",
    "d2025d4ebbef3de30988315f5c63da5bc4bc88ad2a2c18a4a35c23120b04d47c",
    "2975e66752dd629f230376dc44b3fbdd2496937c5f287d50327edc42189b6b29"
  ],
  "complete_candidate_relation_set_hash": "a5f39675f0dce100b7f5839c9641137ed386303554f4ca35c0fb33fa1ec43ab8",
  "complete_candidate_universe_hash": "1b2688e5aaf01e699b4eb2189e5eb87b39952872665521ab0b0039b42a90c28e",
  "execution_manifest_id": "9a76ac35974fe15fcac5031dff26576ed4fedd28bdbb4aece6302f8a7515b589",
  "historical_output_denylist_hash": "f2f48a3142bf192c08cfa2bffbb722e0131bfd4a1ba55623caf5af72748b94c7",
  "input_status": "FROZEN_PREPARATION_ONLY",
  "proposal_evidence_profile_hash": "e24746c96c5f741cc35df8d992d93936911dd1de2ce7f1a0f00035cda3b33deb",
  "proposal_input_bundle_id": "314c8133f59fd003ab7ececa67e2515440fae3dee583320394accc58cd10f695",
  "raw_identity_hash": "4c3c0eecae1174376d5a23a65c2859938dc410db4a71be8e13154f593788e4a2",
  "raw_key": "6000006::S07::A007",
  "raw_source_bundle_hash": "08acf17942f090f59d7a360fa5c07c11bbc27f4029ffca819dd937273c31eb4f",
  "schema": "PROPOSAL_INPUT_BUNDLE_CONTRACT_V1",
  "source_class_fact_type_registry_id": "8cef6206dfc3581c3e7b6358bde7a36e90f4ba99078176cc0e5aff4b238298a7"
}
