{
  "active_authority_id": "36831020b75a201420bd5cfce97a54ada12d44246f56a7812455bc21b99f9477",
  "admissible_source_fact_set_hash": "4f53cda18c2baa0c0354bb5f9a3ecbe5ed12ab4d8e11ba873c2f11161202b945",
  "authority_scope_id": "34551e904bafa71fb2fb6db33162e94ad41a08eca6c747d429c83760e09c1306",
  "candidate_source_bundle_hashes": [
    "b4163b024a9349d8bc9a1ee4d57fe1542fbbe4a60609f38aacb311b7ddc1301a",
    "0fbbf9c82aba2b1a97d6955c3f480cd92841b00bf5c4f824553da1a029752639",
    "a0105dd0a7c4d0d980226682d9e9d662c6d16823629ae38580de25a724e37eff",
    "34463adc913e0f1da7014eaea41b04a9b97519f344d436ce3279fc69bc0c18d1",
    "d6b38601991893c217d8c20e1a6723331b6c12bb75606f7768998fa9ba2a24f8",
    "5cd4a99e9762ce04afb66c849a9fd3b3468cf314a175f60cae2214a355bf21a6",
    "f518bf60d302d1211380b691ad6fe86b9ea027e6c0acba4fe67e5fae4a2695cf",
    "82e3b8d9c0e742b1971b478f25860796d14bd26df27a177e672e08b8e14244e5",
    "209a2fdbf056f0dca4406ec5bbca8d3dca34b6491fda04c678a789f4ce34b5bc",
    "60e262eea4437140d5f47bb6a6fe5d9e2ec68aacddd0884e6ae46c7bf5af06ba",
    "6a218e67832b8d17d8ce71e488156b4935e3e2bf13bc788b9f709f1345d72e02",
    "c1a3e448bb8cdb5b70cb4d167cbe84379fee4bb5a949e24fb5814ab2505a7d3b",
    "a6a81a6efd527c46d3632ced9155fc61387e06da3e233ff0423f3077805ab585",
    "941fc78c289f82753a50d133b29b654a3e0c5cae5b98e57cfbaa1e5b8015da32",
    "77f11a85e664a71d6bd153166859f7f9318fdc301ea123c468a571576050b8b4",
    "f2646a2ea002d47f270164c422620d247b0b1defc42f50c00d1e7a24138bbc92",
    "be15b1999a9deee85b0ac1abea51e988ce021d64f236d3b1b237b5a75510cba7",
    "f3ac4943f3e96850cad27d8aca6318a9aedcc71a90f27b15bc144440dc9c7dee",
    "cb98df1c843df3650b98d854d1a7e41ffc50e02288cfd4545a84bec256957388",
    "affcb44e95198ce47584c3bccab256f0f3fdc415407275392d00f52c3cd02942",
    "800752dfc646c5b2c7bb7da7c0f7fe42deac44465c90d5d770783ac445b040ee",
    "0e70a4aa0ef657e72191d2d43a4e636a5d0c4f452ab93363149f0c67f1763a0c",
    "b019c53ab7930e5ba5d294dae5b2a7ce8b060f8bd69d6392412e3d5689b8b5c6",
    "97a321228735e30eb1c689cb5e7a33f676503965d64e3b12876ed99d9ddc251d",
    "cf680f9257bda3bbcf107ebbdc001074548b8b82c488886d011dd4a82cd9adae",
    "0ac7df99f3445f32531506e73b4d035bdd00f0aa400b328d24afe1c3646e64c4",
    "2d4e8c5ba1fee74ea5915492227c26e91b634198238fbb7b19164bf46ac8d761",
    "e8b64ff4876a6e841ff93a9a23351bfe99fdbca85236078255df69a47dac2d79",
    "f228f5331818786407217561c61a7fa5b9670b3be7a0f6e9af5153bd7304f2ab",
    "150bccb9281ab75fa133f8d3f3a383903ee1d733e7ae75a33e65092fb98d6e94",
    "078624d482fdb8d7f15fe376d95448f7d8b9dfbb1b0ffb43a2df625dede8bfe2",
    "c050e1e0b854595117ed86fb29bc484656330f703a67cdd30ac7a71a09b6477b",
    "284589ab79c82764c4822b014379185b894e6aa0199ecaa42754f343f35b84f0",
    "1f30fc18ade7e047431982c0a7408c9c0b514da3dc2c85bca4e9cd53864018b2",
    "f80c8f177e07fc41ef52465cd91d0793135da24a8e253133971c03e8e5ca2070",
    "bc0abc2b138549fbdf9d23365ad177c37fe619491fe9ca85ac68666a907a541f",
    "ba51c3012932770073ef31370b919c27f3b3816dfbfb8380e4217f4aec6e87a0",
    "02b3b99e98d321558921817fa672370fbdb7f8ca2d2818b76a5cee663b642942",
    "adad4e86b9182a3833160a023c1320b21021613cf48533a83ff8df6b2b5c3e48",
    "7b4009e12ab5074d50ee512d54e86848ab64e5ab8c8452bea5bcf291a1c6f349",
    "4b733e936e0391b53062629c9d1fc7ee7c4927c3f8f983cdaa8483b8db405353",
    "f727021e5eeaaf5909d8dab66727c2050e6a14a4dab6f57e8e4612df12e9bb58",
    "d8821ed8bfc3db826aef39d995f5d9ece1fa7aee4ef9c0aba1abf49ff06b3b05",
    "cf9eb742bfbe3670541dabe99fddae79a17af90148c5850d0220f946bcb2c444",
    "778c3bda6d192d16598826fa26bbbbe69a49770ac8d2966111e9d98200ab0e98",
    "57e7dd09053bfbc67ad142e4e7ec7cd8f201fb50345b5be2fb69d2846000a584",
    "6fdbcc79d85f37de6ed69a4aada803d2e084c7277ce028bc639e946c1bcecb6e"
  ],
  "complete_candidate_relation_set_hash": "d9286ee815f6e73cff8b3896b49719e2d30b5cbf6a178d11655bbf4a0d0fb824",
  "complete_candidate_universe_hash": "42e27294898e2422841eaeae4e523fc1f07e97b36db745a1d8110eca2978ef0a",
  "execution_manifest_id": "9a76ac35974fe15fcac5031dff26576ed4fedd28bdbb4aece6302f8a7515b589",
  "historical_output_denylist_hash": "f2f48a3142bf192c08cfa2bffbb722e0131bfd4a1ba55623caf5af72748b94c7",
  "input_status": "FROZEN_PREPARATION_ONLY",
  "proposal_evidence_profile_hash": "e24746c96c5f741cc35df8d992d93936911dd1de2ce7f1a0f00035cda3b33deb",
  "proposal_input_bundle_id": "fc4fe1735dede33b3e8bdedf7e2b5d07c0e185c3d4f2778f025bb06d1c050206",
  "raw_identity_hash": "8c4171201b17ed6275ede7c2214af32818e953e6900a2f61bed2bcb7010087a3",
  "raw_key": "6000008::S03::A001",
  "raw_source_bundle_hash": "daec81460b5bc347faf9843e8f1278999a72095e70c91ab1fc291651fd8215c4",
  "schema": "PROPOSAL_INPUT_BUNDLE_CONTRACT_V1",
  "source_class_fact_type_registry_id": "8cef6206dfc3581c3e7b6358bde7a36e90f4ba99078176cc0e5aff4b238298a7"
}
