{
  "active_authority_id": "36831020b75a201420bd5cfce97a54ada12d44246f56a7812455bc21b99f9477",
  "admissible_source_fact_set_hash": "4f53cda18c2baa0c0354bb5f9a3ecbe5ed12ab4d8e11ba873c2f11161202b945",
  "authority_scope_id": "34551e904bafa71fb2fb6db33162e94ad41a08eca6c747d429c83760e09c1306",
  "candidate_source_bundle_hashes": [
    "c76be5bacfdb580bf72d63ca6b631a124d601c0b0b28ec117f183980624f0b3c",
    "3695432f94c9b9b425a359467745aff77b6a32e3e98cbbc52eda99868265a43a",
    "1b83abd00a8ad5610accd47ddd3660b22a8c0c8ee2a769cab5ef1b6b59a14ead",
    "20e45526dfa2433cf046f71d70206bb3568911044cade18bce39b7013c0cdb1c",
    "1401576fb8290edfd7c4be0dd0e07d4c6ca6cb1a37e5c4965337c8cf8c08fe4d",
    "cf4ea65e6a82b23bd573070ec4f0cd1cf48153bf4ba5d6659090739f610d687f",
    "a72280b9868d8a27c5381938e3032c75d3a0ef850a28553c442038b2eef98435",
    "81a8b742486640b360c369777c994003f2161d893cb11a4c389c9299eadcdfd6",
    "b75ad806cf3931ad396f4ed7eedbfc6fdfa6e74d6ca02478ca50a474b8dfc3f7",
    "e214a1f9771a30586989710be6d60bc27d51e9779876a0b5864de6830e7373ea",
    "a529f7cd5e2f969a76652ea05fcd414bbcf1b5673b6e71ed2f388cdfed23f695",
    "0ed78c4cceaab8953764569fe0dccc9b257278df533b7c05a035f84c6b894783",
    "aa6a92a08880e1f6c47e1f5f9ba52da8114db3e6ca2591c684edd2d24cba4f94",
    "3eec0eb9f71716c1a6343e912111a088e402de27f52b63fbad3df390a2437e73",
    "9bb0c11af4ebeb22ea7e73f4385fc85c9d310ad92a08844329b91d6679a38ccb",
    "7031d4396b40fff40506bf98a312d3aa2646327bd3bfaa8698ca99196919978b",
    "a4dad80559c34f1630177ae35813acfa09d85ea32fe3c7667e5debd4297f0713",
    "164639f4e26d13205eb9d7c86297509fa9224746c53590f951ba8762715970e2",
    "073aa8a1aac431b8c30dc3f33e2ce866fdf933745c1d31ad5acb66e90d27f938",
    "0dee21f8e93da8b6ed9ca0c695febbdc3c87580f9a7352682cc39223b78ad2bf",
    "9355815e26b1eb2182a17143dd8d087b5a61627a0a671c9bab7130f3d19afd5f",
    "ee913ee37ba7a6d839cf004352df3269f0004a4aef4ab716aec3d1de304b2116",
    "dcc0224eb0c7dd545de93c633ba999bf8e2b3ebc7e377621905853023b92564a",
    "d9f690d45e25c6429df62a8103da8ba2d9a7b604287c73eb8fe0368811725154",
    "18ec45e5ab5371358acbe2345aef740479a4378285e0f45508aa45b1fff8ff54",
    "01b504a65f85f8496b543b5d2316a6c3a8468d91eb2e24068c4b6975f42d3299",
    "c68b484ce2f652e953f523ed9c9c68a530c8a2e1d32ce75594a53d50a3b79e93",
    "2b023f1185266915c06359fb90e879f6d68c98327fcc04533a05de8d57ff040b",
    "4a4d278341166f86fb7912bafeaa4349394b7b6df5fc06e3a00df2e02aa34555",
    "22f9dbbfeb92eae311b41bcff8f15cfc771cffd94a4b5b47b26cd216a45314d6",
    "5c6cd9b038f254c7375b62ddc1aef1ea2c89544771875a76fd8b2c6c91ec3fc4",
    "87cdb00c25614420ea0a8cf045b9429ede0ba34e4dde75014b6a1fb79d98c8e6",
    "c60d06da2ea97ec7cdce7278c5e48fe454fb05a640ce7ebd6f3d1654a07090ce",
    "14b344af2173a9ee3352d127d1063d810e51094367aede82a71df76dcfb24d52",
    "0186bbebe13ba18fe928c9db799909076ed0bf178d6803b6f0f7a4dc47611224",
    "fe0a1fb56266a6ce39e720b76b6289f561048346e6236ddae49c575549771ecc",
    "3ef6398ce64d7200e5645a2c93dbab62fdfe708277964c4b41eeef4f4947a59e",
    "596b79419ac2833581f577862008854a8594859d9def87af693f34ce72b0ab95",
    "6d5a147afbf38a7d4d2210e0599b3f56ff219ccff39149443b7510686733019b",
    "cde04be9318552e4f4d7a50b993a10fcb23f5ee399986fa110f4160b5f82ce95",
    "e2f964e6906c4f3a75c6bb8e6deb78b1ab113d2f1c599c5c02ea13932befff22",
    "66fdb6547753da09a6ca8400ed2a6424a328fc2330aa896669379d9a7f3150ab",
    "62b6f601127d82e361e952603570efcf173a8506c94d13989c0dbf71a8812c6a",
    "c87023bc7b69affd97618ead5776723d466f7c419efff7c725cbfa7130a67bd6",
    "7f1acd4b44819234ff64eca86a43acf142ee9d0b54d5a83b14059cbbd76b3b6e",
    "c78bb2706399f6e31368afa997bddd357def8d983566814cb33e1c3f605321c9",
    "7e8b3d8755d1eefec366407672afc62a4250788d9c13a141e96df928e7077b10",
    "f00b6d2c5d3bd3fde66499692a1e8c2d134ed1de87cc1b94dd9115e496790b4d",
    "329096de9d68441f51d641f7b12191203d6e65b461e370a98cccb6d3d2322086",
    "8f310bbbe86b1ab8f2d5109dd263282ddf4a61a81d0d033c93d506145fb6a541",
    "9be0d207403c9643e0a769fb0a23c5d05d2b5c934ef75430dd2d21f5c52d05c6",
    "5843fbb3f76e4e4d328c41d1d03435d5caf7d4b09bb034ec43d23e9881b058ba",
    "685e8411530b330b05abe27084e015aa25b8814fd1e780690b3ad8ecbd68e4ad",
    "0fb08fb82e31b7fb49607826ad9932fd9d6dc3f0f0a63019cc132b70443565c4",
    "960d638741b8acfc9e1e037238613adf08e2464ef4bf30d369820ae7456bc407",
    "ddfde60a96f539a9022612ffd149ae3cfac3fbb5fc34b983f8a36d47b0e6ee54",
    "2461b982442ee6377a9f4718a454894aa28e6f88d46a68c385d7d1802d3741ee",
    "f1deca7f6bea7400744856e81f1f2af7a5fe14991799ca0f7ce110f0c906ba05",
    "71e8beabf37de384aab902d04e8676c7aaffd5302d3c2dd2a2e3cad6a7ff9f63"
  ],
  "complete_candidate_relation_set_hash": "4ee254cd242dd3a48ec16e8d6d72371e5695a0416fd2281067d624e02cd3386c",
  "complete_candidate_universe_hash": "8827c1995b6ca5f7713e6c39ccf5223542e74ea7b1d01e0fe8392ddf30324f34",
  "execution_manifest_id": "9a76ac35974fe15fcac5031dff26576ed4fedd28bdbb4aece6302f8a7515b589",
  "historical_output_denylist_hash": "f2f48a3142bf192c08cfa2bffbb722e0131bfd4a1ba55623caf5af72748b94c7",
  "input_status": "FROZEN_PREPARATION_ONLY",
  "proposal_evidence_profile_hash": "e24746c96c5f741cc35df8d992d93936911dd1de2ce7f1a0f00035cda3b33deb",
  "proposal_input_bundle_id": "f9dda1596561132bc5a6b5d5abfdf4398e57784636600cab434427a760e1f5b2",
  "raw_identity_hash": "d6424a99bfc1aea87eb229f5e6ea6893637d4d22bad34011305d16fe960eb1b3",
  "raw_key": "6000006::S12::A002",
  "raw_source_bundle_hash": "bd9ab86292de9c4f5c60e35b774603e5b3b16b5c9894a867ecdf83ab1281887c",
  "schema": "PROPOSAL_INPUT_BUNDLE_CONTRACT_V1",
  "source_class_fact_type_registry_id": "8cef6206dfc3581c3e7b6358bde7a36e90f4ba99078176cc0e5aff4b238298a7"
}
