{
  "active_authority_id": "36831020b75a201420bd5cfce97a54ada12d44246f56a7812455bc21b99f9477",
  "admissible_source_fact_set_hash": "4f53cda18c2baa0c0354bb5f9a3ecbe5ed12ab4d8e11ba873c2f11161202b945",
  "authority_scope_id": "34551e904bafa71fb2fb6db33162e94ad41a08eca6c747d429c83760e09c1306",
  "candidate_source_bundle_hashes": [
    "1368b968fe0498282d0bce2d229c4e66968a53fcdc5c38223a0510c5aed93d4a",
    "995bb2b41d5f87b03de51c1cd19125416514ea7424a5fd9c1e871b6bde06fd6d",
    "c3c47a7728b2447739148ebc7633572bbf9cc7d7f44f47c7ba2efec5fa84e630",
    "c0b82da36d4b714800519a49a4076d0d7f7a1a1e91ff24357ee128a58a29cb16",
    "f1ff2b961eacd6eb737fe41081b9129f2b2a4cac983773a2e88eb71ab1fad445",
    "ec1145eeef8a3d6486dd2b0f0ed6e836ddb28f50935eb45060a3d561d737d56d",
    "d81a989e0fffa0cf82ee97a8921aec1078a66659648f6c373a2eebbbb300b4be",
    "dab3cfbfda5ba86a370150b74b583ed79921df1cefa25efc11ceaab44f19c6e6",
    "b3a01787fe561836014ed7ca63320daa8b557dc23c0de95f44872da524abf5c0",
    "6eb582c411274293dd29212e3cd581cf8fe5bd960436a11214fa2098fadace7c",
    "662fa3aafdc96fe1e33e060dc09ad10717cea0f647b8a92633a701eed65aa0a8",
    "1c99d575f01a912181331ee27445d49a7fada21d599c61adfa7803af84920210",
    "d45b3c3156f111463c2c889fd40b8920d97cdcd7028ab05de53f35d3f137d243",
    "3cb004cd4fecdd1e627a5ac0997787ba01a6ab834fb953fc232cfd410d8020eb",
    "5814cb0310fed8abc3b04699a43e0eaf1d3c34cca610e11642ccedd45acf17ad",
    "e46d1e5032a7f9878f8c733ad267fffc06ea3f9a468601bc8383d0b901ed9fa9",
    "cf2ef9ba41564cc4dc19d18f0873603a9e955df4f45095dbaf7e51ce114d4102",
    "a5263ace329637c07f86f19b3ea059cb93f75c7ff36bb39c7343df148e976499",
    "554a04b3a25886bb9fb80782aa89b9d7f81fc0e945c848d6c2d6cc0b8ebcbcd7",
    "1d93ee49c85684d4560193eff52e7cdd75aaefcb662c6619ebfb0f63f6447202",
    "f38b05017cc92fc7a0c208a32aed40183d19e367ab6de48016f0684a5c03917c",
    "dca1aefb63d61e16e916ac90f5455623325feacac59e5d6c88b61065fc66d2ed",
    "06706b1ee84819bbc60ef1fee8d7a45ea95f80b3e0e8b7083714e83e929524c3",
    "f196fd15cbeee79dbed64b40e293eff1d40fd54f7879f4bee69589e968f81e03",
    "6d4dddde6699805b3882d760d87b41cc762984436a2cc9be70d56251ef098164",
    "c4e835b25728f95978806f2d6507bd9428be87d7672f887558448e444520fa9e",
    "64c51e5e7ecf94d8b3275ee5a77d41c7b1061365c48a968a4d14cb0862c43329",
    "e446ea20dd0b0b40c4bc3cf4d32d3d879b4ad9f973c670abcc3d0e2c5afcf4ea",
    "be7ee199d2f9986a852e7940d868be8091b14575072a7562620ad3bdfd2d4ae8",
    "aa0e308e4e6f37cd32361c722229c7bed4524ed44d781874d6dcd8e83b65cbfb",
    "a7facb01b4e937e1fda89889389068bc49970755a4c666a7b56d391136a3927a",
    "0fea8ff81795c9af43b0f3107a74b4e8232ce13e00fdc7c9ce5628bbcaff3877",
    "8ae339580462543d77d262b162ec41817c0df9850f1ed59a12a3453b8b6e750b",
    "9edb20e9f36a3f5a65543c46bae936e4e331f6621654a673e1da5aee2db054bd",
    "526eea5b758b67b354cb532778713854b5167b1817b2be10b94201c82416dfad",
    "6391286988b8b164f0f949e386f30d0541e09bb990d892c1a8aabc860eb40dc0",
    "750721e77bc9a4e4601bcc76e044779125991410959de830e8f6b2bac662775c",
    "74909d795138b5a55f8caa99ce69a7beab44acbb6d1da0cbcb411cbc14ee8767",
    "499f1d7f31c8272b30bd2b43180e93617d491be2b9dc7344b05a6cf695c6aaaa",
    "9a8bc1f489fa319ec18fa068eb69ed768aa19a22be1339db922d23d53b7145f4",
    "f42d497febbfcd1ccf2e70943f3fde15147decaaed7f54c6169d7ccc8c22e459",
    "74138503165cb89a1c864c41bcf92c2871505e6c0d527288beaf746133d2a0e3",
    "19d4eb29663d2e3699ecde601548a850fe10ce387608f84b2a45a3e77f695e6d",
    "bd99efe866701766918c55cd6f154ae433da19ed36f9dd54d3d8bec4ed105b3b",
    "9054d87d518273990b6c203862814e9e90176680e482f2744c9f85358529518c",
    "8b95fea9af3e243cafa8f4ed6b59a6c04edb47ccb3a3f4164668e512455bba7d",
    "1885e702f38e95d5cb6453c3820efd3dd81365d39b8110fbcc75757f2501385d",
    "05bb98f642cec89632bb3c025cc15a1bc5761a0861fd0ec5d6e50c1b16607586",
    "5a73ec819c62bd02632f3eec66cfc5f58f93ee0b393c356eb573116900e81514",
    "19b86cc81dd4f807323db408e0d0d3833bf18cf5484ca4772e343d583490f988",
    "1b3f9b50d62d786987bb9242c98f0c4f317f83bcd911a7ad94fb343c23a290c7",
    "2ec1fdf18eba60cde007f67b7d3bc22cd2ae0c7a9e175936194228f6b097e4a0",
    "9497d760546b42aae6614aa3b7c5c72ad26e7c8b2f8330f434048328182603c9",
    "8ac4b5ec2887a809e31b24fdf40e2955fd716e9aa537d2b968d57e83a7c4c1ed",
    "5b5fc51b20d755cb05e69067b227e46a85f01060ea631c562042283b67577535",
    "959ca921617ab35ce0019972f2dd17e254610ae408c2b14cd274f2bc065fccb8",
    "ac3368bc9bba79cef5d2aac7a0c5658b72d45c01c645e8badfd0ddd6d9980cfc",
    "111ddfbfa4264071c66abc5ea52ecf2f80fd77f3cc5b0c377acff68bbcfa778a",
    "6866f423799de590ea6d9d3d53045d9700e61ec8c7ae39072a985eb6d9677b45"
  ],
  "complete_candidate_relation_set_hash": "9b2bcb627eb45eaa84950690150eb5105ec2a8227a5fe3c5141af2392f60688a",
  "complete_candidate_universe_hash": "dc0d7e8a98b151875eb271ae68d39302aa3ca1251c05d240c91a2959769558a8",
  "execution_manifest_id": "9a76ac35974fe15fcac5031dff26576ed4fedd28bdbb4aece6302f8a7515b589",
  "historical_output_denylist_hash": "f2f48a3142bf192c08cfa2bffbb722e0131bfd4a1ba55623caf5af72748b94c7",
  "input_status": "FROZEN_PREPARATION_ONLY",
  "proposal_evidence_profile_hash": "e24746c96c5f741cc35df8d992d93936911dd1de2ce7f1a0f00035cda3b33deb",
  "proposal_input_bundle_id": "458e101fd578fddd94568bad18f0b6651675c5d3bd2944de7823d837b5cfca52",
  "raw_identity_hash": "b33576da706e7d39ef753d486524a4d83b341109fe1d07805bd90d9ea6a5db22",
  "raw_key": "6000006::S07::A005",
  "raw_source_bundle_hash": "a325b9cf4d89b0eed43d9ba473756a6a0774c34d38e94a2e5b5768d6f3bf66a0",
  "schema": "PROPOSAL_INPUT_BUNDLE_CONTRACT_V1",
  "source_class_fact_type_registry_id": "8cef6206dfc3581c3e7b6358bde7a36e90f4ba99078176cc0e5aff4b238298a7"
}
