{
  "active_authority_id": "36831020b75a201420bd5cfce97a54ada12d44246f56a7812455bc21b99f9477",
  "admissible_source_fact_set_hash": "4f53cda18c2baa0c0354bb5f9a3ecbe5ed12ab4d8e11ba873c2f11161202b945",
  "authority_scope_id": "34551e904bafa71fb2fb6db33162e94ad41a08eca6c747d429c83760e09c1306",
  "candidate_source_bundle_hashes": [
    "bd882d2005e5284bcea9141df51d2ca8afcfb16db29d9d1535650f36d1121d20",
    "5787388f2c2044928fb026f6d5a76ba064a651514a0b7d1129e1e5312ec0b372",
    "00eee811bcd433ceeb31509f020e5acde3795d9efcd119615ff49f3e5aff7e78",
    "eace9e4b3edc705c1c1083b9ddcaf1ce8a9bff8c505e9ca1d0567bd07fc8f3ac",
    "1ec8a3d0e9e62688c628836204ba6f971205aefea2029bc17f1d5ed55970b8e0",
    "1a1257b9edb2b15eba0bb14bb97b3c502a12295ae12de39b23bec201a9c7d4c3",
    "c482a524efef52ab9fa45a13b34e0f1902e4841897b573033806824a133ee05f",
    "a776c368c9aabd6f64771ce0864e1bb181206b70a7c9b68386cf0dfe4002a629",
    "43c8924e88abd787507c3201cf60ebda940c04a067f3b17ecdbd8881a52adf4d",
    "d3c5abaaa5a2fb4d097e20ddbaa67d111a6a61cf368a9df2e14e49f7036bd6da",
    "42f251c7a9acf36f03031b43d76b6e514b93c043f9e6aeba4eaace74b6ed3ed4",
    "c1cc3376ff1a2dbe7201811c35a0280575cf14056ded901d4cd7af31b6e3a60c",
    "9681ed914a61794ebc536de741e155f74f722f3375e575fc2f647542dbc8c403",
    "b40736aaa92848d3db584bbe2c42eab6c3690a6a2414acc46bfacb48363fe071",
    "c6626070c9e67c563bfad2984587b3052a33cb1eb2812827469408e50dada6bd",
    "3ddde0440a8835bd2ce73899128b085558e8c0c257118c634cbefbd603faf60c",
    "b174a64bf72edb705f2f4c7d19868b342fcebfc6b0d7e2ad895706c937a82b75",
    "23da32afd7d3fd33bf2192358b6dd224a4ffdae0066f72c10c46fa6b98ca57f7",
    "0ba7f5e3f69e9c6b9f5a73bac0d3d5c9e835cb8426fb3721b9a84fd3ef885b83",
    "a76ffb75b0b9f4d55897f180cf556a08358b6d69b3c9cee6023c3a43cbc506ab",
    "57db23f984d4a802008d00a43408964f0b9619d64adc4f2aaeb0539308e71e95",
    "583e40687e179842cdeb80d76999307470bff229d75b2f9730678d5ee4929a7f",
    "9c30f47326befb0b28b52b4137ff9e2df45af5cc8b86adf6ea72535a6ed06deb",
    "3f16c46a997464d863bc6f92665c16c53b0787cf3b00c2f2d856affde461e4d1",
    "9aafa736266f0c50f4970f3f2b07e58fa7f232e2d5d8bf7552353834897ad95f",
    "36e9b1232551865cf27705ea850fe01f1d1882ff3f0c5ca6041455760695226a",
    "e1cda9913b3ae22124d06abd6cd519c62fe313198b8088c5851ec18bfc295984",
    "613344f55b4ec0dbc938b194432ed63b95c033543af3d12e91b0e2ee06af8740",
    "6ce23b19443179d8e33d6d3649a6c97b854c51a890663cad2be776a258c07470",
    "dc146f2ce65bd1b118d58b488563aab65f6d2d5700f8b65ddce97a69f204625b",
    "8d5db274f60450d77bad24560a29ba30c9a928ad72198f53ddd246b344da4a63",
    "812dd0dfdf7c1592ff8715a48fff6105249228959313d8602902e526638b27aa",
    "12b49442e530b2613c3a89267a0a85eb56d92d4941d7ee1e0b9bad3f580e0306",
    "2fe57c43c4344ea3b053ad2fe0bec72790ea3840b77584cb513aa90c2088a170",
    "128418f6483c4bfb45c18142b8e671a29c42afe7273dde8919611e27cd4f6f37",
    "c9ab2d2d0449a008efc38e7dfb104fbb9660987f866f810d4548328af971e14e",
    "0fe467702a702fc4347951e1bf3b442346239fec92a47b203fba4007cfb503ac",
    "5f5c4b5ea21d784f9e9ebc457887daf1cb1efde168141bb0cbe9cbe928b732b9",
    "ca3d9def9b12b381baafc05727ec6b9e10b5cbf5a1fbfb2660a34a1c8f6c9c35",
    "6d0e0757869e0876dd103557923feced2772d436e70f124773c7f502208ddbc8",
    "8c7b2f08f7aa5f6d0374a91a4ffe3b8659acef04da2623311c6759eecc5cefe3",
    "eabd76054a6673da52e24c0e6a1d1a4fa62e7f3d13b46dc9be055b228bd440d5",
    "24ec80fefe2ea6584cf1b4330b30171e59511fb432aa3dd0ab3b7c18a6769970",
    "91df036933f96505712060fab5e3c61483fef0edea659b30cef716eaff4a9219",
    "dc43ebfc7b935742218d83a89ef7076a1599c6fdea018ce0fbae8efa44cb9d8a",
    "45408c5bf14913ee96c0449b4328931157796383fcb6967f529f058db7488904",
    "939598d1bf5e5d18d547d647f7f9cf49da0a3950e6c94e406c5c3ce01336ac7b",
    "754cab007e4006e415456a88581dedbd879775a240360eb2229f950bd1f8f089",
    "cb3d42c9dfa0f8cf7d17fb480bc9f5e1f4926514cd8b376306ac58f82cdd16d5",
    "26572471423d44e11df56032944dea4d699748423072b0c04c73bce19b7cd0d7",
    "09bba58557dc99025fb5c991fdb47becce61d3d6ddb0eb55f94238f80de9a6a6",
    "62c99eb58b4cf13d59b3c9c778108de271658c67a8f50c8dc547a8cfdfe2baec",
    "916c9e1bcc3128fe8f5648f8a2376787c849f408a69b09d15b87c7878993e637",
    "52e80c9aa1a561af1fe1e358d6bd273f1524f23e2301cdf698d2ef77d20501aa",
    "b85180f92bc0f51d693ddee494b29cba2dfdeb85f1876cab73849fae835be5fa",
    "e8b15797cbc95ddbf03656d9c991e885df1f784ebfa1b47109c201c8b53c8ee7",
    "b86c9a5f1b7b62c578bb92bf87b63043b8cc73152363f13cd5b5856113b9103f",
    "f6aa6638b4ce1078ca0f64618b3bdd7c35a85f41185003caae39ff9a41c8183e",
    "dde06aa878f6a6a9ce6948e23c375dd2b85132ca75b0ccb0ca71626817c6ac39"
  ],
  "complete_candidate_relation_set_hash": "6e78af2dcb2c8f8d542701ae3361e497a793d237b420b8dca856815ff052a5e0",
  "complete_candidate_universe_hash": "5dd4331015a9050340e2f30fc6bb0d5623dee43d95c038556ed03c5d02dfba06",
  "execution_manifest_id": "9a76ac35974fe15fcac5031dff26576ed4fedd28bdbb4aece6302f8a7515b589",
  "historical_output_denylist_hash": "f2f48a3142bf192c08cfa2bffbb722e0131bfd4a1ba55623caf5af72748b94c7",
  "input_status": "FROZEN_PREPARATION_ONLY",
  "proposal_evidence_profile_hash": "e24746c96c5f741cc35df8d992d93936911dd1de2ce7f1a0f00035cda3b33deb",
  "proposal_input_bundle_id": "ccd332d47e056007559fb60326e6c4556cd93568fa54804335f57c66f968af4e",
  "raw_identity_hash": "a1ed63c4b6eb75bbee15a03fe5a4812bbe3216de9db988ed6db1d60775ff5778",
  "raw_key": "6000006::S11::A001",
  "raw_source_bundle_hash": "3c2fdda625c7327425d445be81969b672c568414d66307c5b255db169ce7599c",
  "schema": "PROPOSAL_INPUT_BUNDLE_CONTRACT_V1",
  "source_class_fact_type_registry_id": "8cef6206dfc3581c3e7b6358bde7a36e90f4ba99078176cc0e5aff4b238298a7"
}
