{
  "active_authority_id": "36831020b75a201420bd5cfce97a54ada12d44246f56a7812455bc21b99f9477",
  "admissible_source_fact_set_hash": "4f53cda18c2baa0c0354bb5f9a3ecbe5ed12ab4d8e11ba873c2f11161202b945",
  "authority_scope_id": "34551e904bafa71fb2fb6db33162e94ad41a08eca6c747d429c83760e09c1306",
  "candidate_source_bundle_hashes": [
    "1093fd97641b990361a35b84dfbaa4f9d159820805b59d30fd4152702913f4fd",
    "7f94621cbacf0d719dec2340fd7fdebf730acb5f93309ff6e34c94aa427c16d5",
    "5c19a8413b439b81ecf4ae4c31cb4ed2aa1134b938b7d7a577e28c4039532424",
    "23189c3bae3df8f6a7d89f7cfe5925821d738e4891ca8aa78a67289e7aa12b3b",
    "fd5d7c8caeaaa396f7baf90c78783e8ebc5e1443d2643199bd349251290ac7fb",
    "ac9d32ce6e4792717417e7e10d5891b6ff577f9b7c5151b45f8a093963a3808e",
    "5184d5b5172a76f32b73b2e27174f3ce3eb1447f147bfac2b496c0c647d5284d",
    "603de0ffbe0550ca2e79f50ee77d9db542fb54cc27dc43c3b528a765ba8cfd1b",
    "be3ec0f5c50e77ba24b8b784e29fff132aa420fec645589af34252e5c5691c55",
    "e6ec9b5e8f9df22fb52995dfef88128be594c6ae8f6478ff0275e41a68b823bd",
    "99b629e8c80e40c31a096eb6c13345c95500d245f6e69826e999b2309c1fa84b",
    "dfed2622cb908f2949eaa6bd021426cc4955ec465d33370c7e3683783a805994",
    "19a67c4ea3450403f070287ec93bdda2df9f3e4e8ff6196da88790bbefeb2a51",
    "2ea7df2fd40485717c5716d42ffc941c680b5aa2f9962bf8a2d039aa8634cb9c",
    "692dd88c3bdbccbb3487a32dce41e52e78411199b613ce49aa357ef33d86ad58",
    "69089cca082d489f667db1d71bd929b6b0ee61a83761467ab27e52ecb7d45b18",
    "158af3e39d3fc7a21ad8bf78072931c86c06d674aa4b5b27ab165c29126f5713",
    "9f02accba9837f8fb7918e9348b173f2d0927d471bb10acdb7cb7d889932aded",
    "ba982857f1162965440f61086287c4037c1a6e749f3dc7d4ac825653aeda55fb",
    "d527e86c81a1e756f52765e51281547c9fa162e2da95879390b3ff7b68489360",
    "9420f04552a7544c69ccaeaba979dadc1903c8fb3b63e2731c67a2d810f948c7",
    "034923103197d8d29c1a318a510fd9537e5a129315b7201f714fb8cd1416565d",
    "36314a67d2df73440337f24391c42e9d92f32e0f1c57255409688f0d3c1807cc",
    "8b593fa7ca65121d7617d5c855d1a1bf20adf3c4f1fed374148c495b632efbac",
    "f78690b495daef362dc658cbb9499a9c888673de2d107e5baa216817f00f3f17",
    "54708268d112ecc3cf261484c70aa0db150cf423f28f11cfc52dc6206473fd01",
    "6c410525219666e6439cd8aaeb8cb1bf9bf030ee2a834685a4c279164edc2155",
    "2405a02f9f8f4843b90d0a72fee3c6b3dd580c070b246f111a4147091f594fa9",
    "e4686ed371a07177e7f289bc870cfede90e724c677f270fa4ebac1f6bf4597c1",
    "de04639caf4c2013ae11206c63d32d961305980ffc29e9545a32ebe2cf02b96f",
    "86e51bee57abc9a3d10f90cb5eaa4df430bbe5de7f6df07f868c6c3435991423",
    "7585479be1a52e6bbb221a8756292a5692181c14e554518877515d19bd3596d2",
    "12349ef827c784fca4dcb81e1d17c6995a00c1547ac05c3212a7dcb761bd958a",
    "4aff07265c3277bb066a93aacd869056f22bf08cf8ef1e4774dc7fefadb94cb5",
    "37b4510c81c1f048704263e04a28a571d879b075d40dd0b706968bd9b9125280",
    "682f3a46a6460cf51bbaca868cfc69f2cd21431a34ff01f4430c4be54aaa0b97",
    "ccb57ecff86d1d153554bdf24d0904c2386be51e8d8c9172e7f330e9225b60a8",
    "9ca4b41f8db36ec0521a71e021e7b1a65c67dcdb4d5febbfe2af75ba1f5c5e60",
    "a6c1f9d0e6987b0702ac552fdcb6986d0f8f5a5187ece05bb8116e2dd7dc5941",
    "914e7a3ef16804557bc01b053c8fe91b0c1735f4159eed2fd36b3d3c96a78fe0",
    "c90ad353698fa2a061eaf67f9d1f497998032dac1d9b090e160679245cda8f4b",
    "96347014795642fee18d719ae09280290669be3408eb70735c28ce584c80bc46",
    "db187bf75b57798d779d416bbf4922af5d27e4fd165e5d1fb2e4fd73d690f69e",
    "fbfde1f2940b64fc8f955336e4e700964ae296d3deb574a0aca490665a936b66",
    "5aaa4db0e7e7cb4326551fc97af1e2a50cb83b9235e307f43d7ffea96a1b5b27",
    "3ca7729e2782bd49731ef92a33235181f327644ab35fff2a1fb6d2b251ff2e4a",
    "9198c203f7bf4e649670401c785843793033c256545f20ce57011c565726af7d",
    "4062f4677dfa05cccaed39d51bbe0b92715667fc70db0dbcbe884660461fc0b0",
    "e756716064ff514c4def4f566277ce1ff716cef7ca437bc93322b686db1b55d6",
    "aa19a698e6713f5c0914a0c2560a7b1df3d4cf53e062922b71228f9e03486e74",
    "ad321b69612585156d65ccd913ab88504db52db32debeb4f770c38c1850bc62e",
    "437c4a9b38168fbbba426174cd9ec655a77a1ed1ba9e80f3ba5ac6727b341afb",
    "cb0ce45a6abe7767695e0caa522dc586e9e6e1a6e2bcba8121aa943f9caf190d",
    "66eed05843cff6008c2169c470c3aff2b0055dcaa2211005c774bb8a322d43bd",
    "ca9ef869d5ef805cc6512d4d4fddaf31fbd7c40c28bd27c2b0c4f1f67048afbd",
    "69bdd4e8837d2f9e747941c5bf27297226d02ee753df9f444c723aec2d0da677",
    "a5a4060409640956a9361b51c82b56bbc93b3a960fed601bcf68d9bb0da018b5",
    "46053c535b0e896abd1ee3e2428c7e7b26ebb9d1765e596a2743ce710d211217",
    "aff1bdbf6a75ea2e071672e0709894af62467f29063bbb94be6a5375de5d2629"
  ],
  "complete_candidate_relation_set_hash": "02c91ff4402519aa96db85460d95a3ee96600cfc0f8aabc3ae7f424d0c80a90c",
  "complete_candidate_universe_hash": "bd96fe0d0dc1c00b8ed14787be138c1c72a924ef02b83ffaf9d17d0697db1df2",
  "execution_manifest_id": "9a76ac35974fe15fcac5031dff26576ed4fedd28bdbb4aece6302f8a7515b589",
  "historical_output_denylist_hash": "f2f48a3142bf192c08cfa2bffbb722e0131bfd4a1ba55623caf5af72748b94c7",
  "input_status": "FROZEN_PREPARATION_ONLY",
  "proposal_evidence_profile_hash": "e24746c96c5f741cc35df8d992d93936911dd1de2ce7f1a0f00035cda3b33deb",
  "proposal_input_bundle_id": "ce4d78cfe2a318d0e0c4d06252b05b6e5876e170bed498b67d748d32b1e76ba1",
  "raw_identity_hash": "20bff7c4592b096e89ed35293773132764f40f9e7d2591b336caf33468ccd429",
  "raw_key": "6000006::S03::A003",
  "raw_source_bundle_hash": "24ed45fa32bf3ad8a4ef7149036e37048311145cf54e4e59c984724d80b1761c",
  "schema": "PROPOSAL_INPUT_BUNDLE_CONTRACT_V1",
  "source_class_fact_type_registry_id": "8cef6206dfc3581c3e7b6358bde7a36e90f4ba99078176cc0e5aff4b238298a7"
}
