{
  "active_authority_id": "36831020b75a201420bd5cfce97a54ada12d44246f56a7812455bc21b99f9477",
  "admissible_source_fact_set_hash": "4f53cda18c2baa0c0354bb5f9a3ecbe5ed12ab4d8e11ba873c2f11161202b945",
  "authority_scope_id": "34551e904bafa71fb2fb6db33162e94ad41a08eca6c747d429c83760e09c1306",
  "candidate_source_bundle_hashes": [
    "9d1d451d07a5b76105048f19b20f4ccba7b1fb8c38c92f99200069de32246a98",
    "8a417177fc3c69955651eb0d65b24ca705476fafee47a5bb297d5774523db70d",
    "5217e6d49b6104f1b6e387166fc1d421a50e86d7c1b0f0b87b149b7c4d61825b",
    "1ba9d1c3d27a252dd1de3c947bfc9eb28424e9c4f46c86651ba5be30c2503493",
    "bf4766afe4ca3442b44f40091fdfe42c4a715fb7ec3ea3e7ac01145f11ea137b",
    "1c8607ab21ef928bf8ae9459d02566fb0cdd341aa721f12b9d2fe11ca037e379",
    "f9e3bb0b945c29ded1907a86adcb18173f03bb65843591e265e5a3ebd36c80df",
    "01ae4f5254a946ad465b6acee9c63a0a6e92726d99e9d271f14d8d9a584a3ff2",
    "4381ad79bfc7a74394d6c32dcb4211df9ab3efb23e9953680ac11e4047405879",
    "5eaae419742d1d4999655fce892f20884f712ffb78c843a3f504fdad67fd57b5",
    "d03090f77900c575b232fde75cbc110090f16cb050f22071d382e8fb5d010b91",
    "f075694fd8fb554a851541a64b26bcb86c5f276ed2c116661e2be7a25a4f0fcb",
    "636ab63d4f1fb9083abdd8744d4817fdb0ebd3faff372f8239865ce15ccc99dc",
    "4a6e7cb5ca1cfac83574a61007c1ebbaff29b8c7b7a3b322d3210f35ab5b123d",
    "401dbb48dab55f58cd54ddb0a468e69f1b5363fecf4b2a354fa3fa1802eab07e",
    "26ca14d270e351f7e7853526e3cb8e22204a3e5e78129562c5f70d610f7b3547",
    "a04f4a97218daa024d277915ae150a413247710713eaab100e5b9424c853336d",
    "138ee9f911c75f47be933701972fdb03474ff618868b5b79839557e0949cfe19",
    "ce2b2932161533347d0b5248c6cbaba0d11a6e8be05b52733664e2f95d08eaff",
    "350a844c2bb85da7bd343121902f5b81cd77904bc72ed46282f2198eb323a521",
    "373d565b4956d7ef38c65e3a1446210db9957d023848196b0c078a7d1407bed7",
    "efec11698a493fd646c50ae032914782338abedafbf33b23de99adb19f85a444",
    "8ed81041e23bece67ed0e5a390554774f316df43b9c45854d528b0333af15ecc",
    "4fd7f43f60b76f85ec6bd4fcb26fffc620bdfa5fe38a189d178ab65cd18fe6ce",
    "c27e5f27d0fea05f381ed3e63e06a2b338aee10597b0a4153e57774d914a9dd6",
    "83e6ef2697c24e75513ad1fbdf555cb626053a5ffdb4a842e5b9ddc7486ea4b9",
    "e53d747f0c2219b688a713ae41548b1fa58afca890cf526eaf7640b649110a38",
    "be69fe7972802551be1a3ba600fc27a226adf07a2b48be53ec7e983cfc620f94",
    "18414cff39aef526e69c472571fe43147aefd4c87da3bb6097392464d2265936",
    "510d7c77f939f4ea4605035d0909d1218f98f6a98ca79d4ecf610090d6222c81",
    "1b93dfa5465a135f8a67f9bc6516273ad31d7cc764254e736812a77210cb30fe",
    "ef2dc1a0a4b6382d0f6005d8c9a63bdb4c3ef32194eb72224131696103f8bc7b",
    "8f7cc14d7c0ba3ae0c5353edf966f9d37037aa363f6a4fff0a15b5d72f8f1663",
    "a494b38222c499aa931725c1cfd99063497395f4540e381737977433a27efe02",
    "66c34ce9c3402824152de09287c246907db812f74797a05831176d4168f5d3c4",
    "c5ea1c3daaeddf2fa8c4ff5e51d4f12b3fbe797aa02492638015a377b05b94e5",
    "71be4aa8359a227b076406eca4a4dae70f5e293f0f30cffca844515e557ade27",
    "2b5402c0116445102cbd448af7507f13d936c64f4e0b3725da09511ead965a38",
    "e4531f9e8ddcb43ffb38a1868afbb2a89624f45e744e8a17597e0119e84dddf5",
    "01770d020279a1dbef4986ac46a087cc85005d541339b2bb3e35fdc6d0f1fc8e",
    "a1186898b31f4daa169c99c5ed704c00f9d1a29f3a31a1ab3ae50ef20e36b3aa",
    "afd3c3058226e117a4b1b371c62dc033baac4269bbc18694396a8e3292de73ab",
    "33bb441025f2d91d6efe1354f21b7ecf2e55c84cfe63f9c6872c681f38f55e7f",
    "1d41feecbc453ee8518470df2b50c551643ad9f1e1de79cd8cd1d9cd90f4b894",
    "5cff8852b14a6f7c509626599410656eeb993616f1243f2fc415851fc0ef5930",
    "2437dd49201cba24a9b82065b8ba68486e263463d772bd28c41c12428378a87a",
    "6e951fbad35ad01f2667a28268cb985cbd34ebe45419fb5e1448e578bd0425a6",
    "78627ce33aef8b34960c56dbe9922551b1220ec841c624b31ab9f17fc6104247",
    "e0b793a0385a8c0ef162552eeca78af42e3ecbcd74ea84e864abd94c58cc061f",
    "889f4af58b3d4ee14636f8894e01658c066d30fe49698750ab7d6b4fed10fc5e",
    "1d238306ff07bcfc0ed642a21fdc64a314e885be9d7fc2c0828255208babd9b4",
    "7747b189662a3fe890cd77e355fb11c1c867ad3a641f26e2c5d2af3bc7596058",
    "c27145cc23c7a3268f6a1b3382dfef085713ac537a02a89075fe04bd941a226c",
    "edffa898fb070ec7b03a141bd174c092e79e536d6e5fdaf04bdb46a49b240543",
    "a255d2b69a1087efa29e714899b77057aca8731a43bb0a9f50bc045c218824bc",
    "8e09a2288b533500cad181a7ac6cff635d5c03cacd2e846d1b5bd3e851bd60d5",
    "8e05ad22103f320136869c4e1d0e0570a8421c42013acaeb14f20903aee2a7a8",
    "2e326839b7af2c6d60d7b39c43ead752ef880abdc0232153e0e44e279a6ae729",
    "a61233355709e8938e2686df8201ce0b2c45eb42b8df991d8d30bbc0806b9334"
  ],
  "complete_candidate_relation_set_hash": "6a0ae48fa2276da756c37fcc378d5f81a7799583efac65ca9d5d418e4237ef17",
  "complete_candidate_universe_hash": "73bf2e2ebc3b6426e655a7f1479513999cec9fe0712d47029cbb832ff1a7170c",
  "execution_manifest_id": "9a76ac35974fe15fcac5031dff26576ed4fedd28bdbb4aece6302f8a7515b589",
  "historical_output_denylist_hash": "f2f48a3142bf192c08cfa2bffbb722e0131bfd4a1ba55623caf5af72748b94c7",
  "input_status": "FROZEN_PREPARATION_ONLY",
  "proposal_evidence_profile_hash": "e24746c96c5f741cc35df8d992d93936911dd1de2ce7f1a0f00035cda3b33deb",
  "proposal_input_bundle_id": "146c9634feff9339d679cf7a10efdba17e0a8c013e76118ee6cf1f4c5649807b",
  "raw_identity_hash": "f4313bff0aa948b28c6a84150105eca5749a7b4b778d30312f5ce80080b5c7b4",
  "raw_key": "6000006::S09::A006",
  "raw_source_bundle_hash": "397604e77e55def23d0aba5f8c664812dcb8f70f729e42da57291900d8b10591",
  "schema": "PROPOSAL_INPUT_BUNDLE_CONTRACT_V1",
  "source_class_fact_type_registry_id": "8cef6206dfc3581c3e7b6358bde7a36e90f4ba99078176cc0e5aff4b238298a7"
}
