{
  "active_authority_id": "36831020b75a201420bd5cfce97a54ada12d44246f56a7812455bc21b99f9477",
  "admissible_source_fact_set_hash": "4f53cda18c2baa0c0354bb5f9a3ecbe5ed12ab4d8e11ba873c2f11161202b945",
  "authority_scope_id": "34551e904bafa71fb2fb6db33162e94ad41a08eca6c747d429c83760e09c1306",
  "candidate_source_bundle_hashes": [
    "3cd6e831314354c1affcad707d54c6bca5dd4700812e57ca1e3508f6a8ad5f44",
    "a1bfa3df6bcf11236280d21eef9b2ec0015dfec158acfa8cb185ce16cd9bf261",
    "e8bbea034d7e89a8b95d42e0487fb0c0aa2ac5b2002e9661ac60793f590d217f",
    "abdb799befb7a37189638c3ef06aa533b4dada0df22b3a1f322ee0a100d09179",
    "6f1b7ab9a48ab3eb7a01a879fdb83c84e1e7ac12f2cc21592b5c2a2506e52890",
    "5b297ef9e4ac95ea93c3ab1e107fd1096c49c1e63a28cad9df87e9d2d9985918",
    "3dbfe312c1eeff793db52e4842f611894bd4bfeba34599dbcbc57b056b8d4181",
    "1c9771d437a651ff4eb616c35445c224382edf97a9eb37c3478e9106bce9fc18",
    "dc2462b6546e3419197d0321ca5a19fe0f1a3255e9f4766b678a78e16f6e5c6c",
    "aa8319cc80a7d968d2ac82efe4f24772bf80aff8bb6e484a3ae29028c764249c",
    "5114152a6cc5f65be4873f28aacd8362b530042b8557a6ea2be351408d5cbfcd",
    "55095bb8fc05948fc5baa64db96f48cde97256e635f0dd49da25a1c20654ec91",
    "0e52c7734f8298a37121c39185cabf1e0929caabc7aa9832549208cea8b88ca5",
    "516725df2304b0c08cdb0564ec72483747472e0d0ee815227f74fdccd53156b7",
    "68f3776b801acfc9ab017e023f9b7610cab9585b0b37b420c81b3ed50f61d796",
    "0e16d2688779371c53cb8290cdbdf6cd0a770efc2537d011dab631a5e24b8cc3",
    "1f07eacbce5c524008b018eb2e236c2ac5a839a084404c7892862dd1c51d730a",
    "5f9699b2279149a010ab69df692ec6d4368c6abab8c18ed1da8c76f29e38ad16",
    "3e8493a0932097e1a1a8773c12f9be5fcca8aaa100f4a9f4dd744c038d741cc4",
    "82a048dd7b3a9ff686610310236700290fbdd90a20655602c9f18acc43a0e298",
    "f30a187b6f2718018a67f2d684e95dcd02d0aab23dcb3fbc1981ed8cc234253d",
    "578a89e518090f28497cbedb18cf44a71fff5f5a5749384e6813496e9d546a63",
    "7833e9d539377ea039296551157265201611b10402b95d7bbf77095fdbca7d67",
    "1fd07de56e4db651a5da175414cd08a3b0438e799c487ed171ccc6169128c699",
    "0e60451b637d0c3aa4805803c8050c51ea420993019cb9f0d062f7bf0df8a01d",
    "3752b048d38b16055a8020f979528b3ecd3b8e3af06da89b570d8d8169ce5f44",
    "6259394dc56608c9ea7fd8884e194cbe4e5d007e8d1cba894bcf68f0bc79340d",
    "10c47ad23ff1d4dbd2df989b2b28786f3336c03ef4c57879a2149acaa179ef2e",
    "c8c42ee0d160c90fa0678581d1aef0131682ac5fcf0602155c450e9ac070ed7a",
    "bdd2bd1288c76f70e49aa6134482bbc5c4330ae1fe75a7ad1e75dc7b64ae8c71",
    "06a7f501803637a47dce0b67277deaded51ea5562a9584f6362bec33abe59013",
    "e12928fbb0e11fda6a3c8af8efb3afed7cd584862f5895556bc07e667cef2626",
    "38c9419b23d4d340f57b92e53bb05ed579db59a966f05c686de720fd91e250a7",
    "2c4b484d99c659c297c0d046d6c338d849853ef45838a6a2491ec1b314df435e"
  ],
  "complete_candidate_relation_set_hash": "0e13c04dc6640cafb7a835db017c330cb88e453d3f981efc08b865fea7dffdc3",
  "complete_candidate_universe_hash": "6b045eec1c5b62e96c70867cd00184cb431d1b38d5a39024fc9b4330cbb3f672",
  "execution_manifest_id": "9a76ac35974fe15fcac5031dff26576ed4fedd28bdbb4aece6302f8a7515b589",
  "historical_output_denylist_hash": "f2f48a3142bf192c08cfa2bffbb722e0131bfd4a1ba55623caf5af72748b94c7",
  "input_status": "FROZEN_PREPARATION_ONLY",
  "proposal_evidence_profile_hash": "e24746c96c5f741cc35df8d992d93936911dd1de2ce7f1a0f00035cda3b33deb",
  "proposal_input_bundle_id": "03522a0a9c5a236579ebc704337bd5fd769440b07c97f61ba2f46eb68e65dd7f",
  "raw_identity_hash": "9b123a65d77304666775bc5b7f5de8092f73a81506a2be212002f7cd09f109b2",
  "raw_key": "6000003::S06::A002",
  "raw_source_bundle_hash": "ba83a148c61558f0549ac995d66befa5f893bca62d4bcd2a775689f4c2c55ff1",
  "schema": "PROPOSAL_INPUT_BUNDLE_CONTRACT_V1",
  "source_class_fact_type_registry_id": "8cef6206dfc3581c3e7b6358bde7a36e90f4ba99078176cc0e5aff4b238298a7"
}
