{
  "active_authority_id": "36831020b75a201420bd5cfce97a54ada12d44246f56a7812455bc21b99f9477",
  "admissible_source_fact_set_hash": "4f53cda18c2baa0c0354bb5f9a3ecbe5ed12ab4d8e11ba873c2f11161202b945",
  "authority_scope_id": "34551e904bafa71fb2fb6db33162e94ad41a08eca6c747d429c83760e09c1306",
  "candidate_source_bundle_hashes": [
    "00c1cb8e827ff26ce3ce32a8779183d8f532b2c58845a3f9c68e8d76c939c877",
    "2b47f197c1db63e4501042a0bc8732cc7263e4c3be479c444fef563527b8331f",
    "41bb5d89487df7351f69f2a4a3514e2fdea2ff1bea6b1a5932d22ecfd4fa8644",
    "64079277e04c9e598aad65744c9925bc453a5bbabf528afc821e0f42d13cb658",
    "dc2dd664df20c90dc6459102a94ff672b6901099b123cd6168ccf0022ad87c60",
    "bdf939d4d367e52fbe215bc53c5afd1178cd42f4f11f5b71c517944c32cd0bc3",
    "693cef940b30ba1c32112ad79c81bc5503b5783b7fce9e50ab90d151e15c631a",
    "1f6a35f1b1fa288706bfedaeffbe938af653ce51d3370010036d9cbcbfc3bd6e",
    "93454904b516d60618975e9937364e43e813953b7fd525e47d9416dcf863d6e2",
    "48fe2a4204bab34536b9b86a77b585a3baf76fa79905a20d8bb05841a965d43b",
    "205fb870275e6cb66b1d4adafc95d8657d7b5e25095216b6c079532f3b289a5c",
    "ec8dc1f1d40bb59c25adbacee6a0714605a66f4089afc43f22c0d3228f6bbaea",
    "9c1f7af83fb762e81297854c164f577403d505b99ef529b4cea0485e0b4e0744",
    "b23f8557935984ee9d5814a1ee2700da94a340c400b457803aef7b3d083a5d03",
    "67213741a6eaa7fcb6a4ba6f827a9b06a86978e23dc766b1d083d572a5d19d94",
    "b8df94545159281f2cd472bb87515d3ad49a580b39cb94396b66cd7ca3d3c88a",
    "de6c906da07669a1747b41a2d3da79f481dab667fedbf17bac100d2aef276670",
    "92de564cc200480f0cae097c9dab513adcd6f99b5f9e6ce532f449e35db70620",
    "694d1197ff6fee8f3af909f1cfd203c67560c78ba3a9260a5aa7562755a6f45b",
    "ec515ba22366cb3c1deda81fc90394701b0545efa27af0fbf1fcc11834c3967b",
    "20c01f41b804bde5bbfef7e7f103c00f4d811e18f4207e668361fb15ab62dfe5",
    "7b6fa5db97b93eb7edb8bbd120260ba57a68a8b70a6337e4e66416ac00ce792d",
    "b5e5799ad32ce98950127895812e4d1fdb29e5d94a24b0cd2251a4296080bedb",
    "1eb627b757b98e94734d8cbdaab60cd045b7beb47fcdfde6d028f9e9ee4cd8ad",
    "fea2899a96ebf1386bc7e7ef944cc7b49dc5d1769efed0eacadfb981dfb39491",
    "f726a06f01d87fd99eff4bb196401c550593b213cfdcaa686cd1e11808179821",
    "f7c2c8a34a061bd3ce2c37eec9bee72854492f7cdd112c1835e81b85ece01897",
    "5ba760969c4a4365e1ea223e6ab326e26d3b2d1198559cc4b6dc0ac5eb0819c3",
    "18c839e65ddb1c4652b7dd766c900df320dc17c411f526e78fa32aa70eb077ee",
    "9f0e97ba67beca1596da301e356fde107c32844922f666270eac1b2c2b14ed66",
    "1e79533457007d5fcaac771c2d8f4cca53eb37db65f0a830201b604ee0be2bc1",
    "f99ce5084ab1ce40b9dd320a8a93698590c600eeaf97f67d70117b657703c29e",
    "f26bed2e96b430b2802024b6633e00aeef36ac2f1504d37c5f8002c9f252006e",
    "6c605cd244c2502dcf176d94d9b2c08711769c1d6cd7497afb650c7c623c0291",
    "4217be8230e696cd6f38536630c0a59ef2898b38b228768b3a11fa9e4af8f6b7",
    "7c0948a01ffad46f7b2832e528f7ff7ccd771f3e00bed671778009b6ea807e2f",
    "f3802aac61af6253770640d43222d9406ac24fda33c0eb6ebb91301f86a19e6f",
    "b15b6bdb1bdc44a6fbd1d6ce77e0c0d66b837a70a063f87d7280e7d41b8f8144",
    "b983600f950998577eb32f0724bbb2246c5e0dae58513ddac0119e1b24138b66",
    "9fdea2a77cf9d4e73f395c1eb701719f6c95e9c634c74e3a5e19884656af26a7",
    "6180c25e46524ff26914e123dd5fe9cf6168ef1e434e9602b51f26b53c0e73af",
    "2636b27a871a7ed790d5ebc72713dd44c8a4acf799e145a55d5983e8cf45044d",
    "ae8be4cacd95d5cb3c719384b2c8b5ae3932f442c061c73e73f3df56e648e317",
    "0308de33d90349cdc79bd344fc7c49871bbfe02f7b91c4bf7f826078b4e3ef93"
  ],
  "complete_candidate_relation_set_hash": "94fc51ae1196d176a99db27e6265d484c02e90bfb887c3781e88874f2f7674e3",
  "complete_candidate_universe_hash": "506b5f1d019cb35a3a563433f0ea8d22451855b7f0c9437644f25762211f8574",
  "execution_manifest_id": "9a76ac35974fe15fcac5031dff26576ed4fedd28bdbb4aece6302f8a7515b589",
  "historical_output_denylist_hash": "f2f48a3142bf192c08cfa2bffbb722e0131bfd4a1ba55623caf5af72748b94c7",
  "input_status": "FROZEN_PREPARATION_ONLY",
  "proposal_evidence_profile_hash": "e24746c96c5f741cc35df8d992d93936911dd1de2ce7f1a0f00035cda3b33deb",
  "proposal_input_bundle_id": "10c68e663180e5d20b224dce24dab237497d8bde3b062a27fc6bb06fa17b281a",
  "raw_identity_hash": "39a446c39d6415e2a0dfee4e5d9db59aa40656e38691ff0f4df4f6ef46c7095e",
  "raw_key": "6000002::S09::A003",
  "raw_source_bundle_hash": "e7a68b5284e8c4f70987a7ec1305061b9d4f392b6f487c3b05605a7c54dd4ddb",
  "schema": "PROPOSAL_INPUT_BUNDLE_CONTRACT_V1",
  "source_class_fact_type_registry_id": "8cef6206dfc3581c3e7b6358bde7a36e90f4ba99078176cc0e5aff4b238298a7"
}
