{
  "active_authority_id": "36831020b75a201420bd5cfce97a54ada12d44246f56a7812455bc21b99f9477",
  "admissible_source_fact_set_hash": "4f53cda18c2baa0c0354bb5f9a3ecbe5ed12ab4d8e11ba873c2f11161202b945",
  "authority_scope_id": "34551e904bafa71fb2fb6db33162e94ad41a08eca6c747d429c83760e09c1306",
  "candidate_source_bundle_hashes": [
    "e6a4f1f4693472685d02d47347d749267f956f2a0060e4cdf76903f7545cf2eb",
    "fd2adbf64a43bc5bccf0d0b175b68c6115804cf9db74ffcfb16e2f526e92ebf8",
    "cadf234449f0cdc3bdff11a89541b11511ee0a3284a444319bf35b4ca5a66ba2",
    "ab589f0f84a25c9dfe430677c7e63ca24c45ea67cecc5ef89a98966cf534804d",
    "a7b27f930b872f9269210eca82eb1a530a5afff1b2ff380c72509807c150622a",
    "cd4a7222cbe8083af9c13251ceb73972f2fdfcf8488837a562485c55af6e7eb6",
    "e16527719d2f6b653c0982aafc1232e6431a087b4838c44856776a4a47d6fd12",
    "42227be3cbc1b8e597c58b81bf914ea8011599225d62d71480d7b18346bab7bc",
    "fedb5289dd934cb395ace49fc93c69f4eefd45c787a7215e3ffc7b20497d3ce9",
    "a3662ba009dbd17db677bf49227d6e213fbcdc5dd7b221e8a45f84c07b931414",
    "94f2facfa534afaa4f0ebe5cd3166e54e4cc83cd500feacf1eba65f0115a4672",
    "11c02e562237311ac8b91139a04f50e87a101f85ac52c6766de136e43e9426f5",
    "9713465ab8fae9a05c15487f911c0e290f342bdc5d0f45b829351174520a2654",
    "4ce5112eaef534df0e0d74147ea3725b9e1456d476edae633f12961d1602bf45",
    "cdb0d43560293dfaa45f9af82517e13e9ee23dbf42876e371f16699e441df6b5",
    "e2db369f1f6d8a75b30c51cd82c44b0c330f4f83217bf9b789478b01a09b5bde",
    "d3929fdf71bc8f46c2852bcf1d094e7d93f11030cd928f50135eb14d06674a13",
    "0173aa9519e426e2033d062e9d234e4dad05039c0535050a79c32cddd7d80d13",
    "e947133a3c1599a77b53871fb51d5bfebf07a8ce685ae075734917b10d5249b7",
    "5d1d8810cd0703269e40a42249ca256fbe04447a2570ee5fecb8d0d2a2958844",
    "713739c68ce8b7d3775380f4f0f8a375443c2d474290ae9ec5ff2d82d6d22da7",
    "9b2d2e17ca6d401512df7855676b7f41d82e9118fcd82e622aee9fb8213c51e4",
    "b563426dddfe6d0c25938235591a145bc832e9851ffaa5060599712ac23089f1",
    "4117e2e7a508b002d73b3cc0c15d72b10521b5e1b585fca79d2f8c775e69e908",
    "aa5e3193bab09235f2064dd7e681f022ec5fc77ad24263ea1169fb83914f2ed9",
    "4666007276f83eec7967696deef44d139d2ad41616d7788a0a27684222812955",
    "51f02c3c252334623dfea76a3c9bb161af6735329cb851e16d235c3d590e769b",
    "36be7d33707121cdb6cb8851e7707f08e7855a3c6ca98f5af70636059e193f64",
    "1249428891ced5a4c0ee15fd0b31bc29389c8838185f78a628f56e0fe57cb4dd",
    "7badd83ec7eef1ae4346151214fe337921ad95b3868ff059f37f0c60a9c7e17c",
    "86231e998ff33b7501ac50ad63b56a80999a8124e10f125ab079d0edbd94a315",
    "2315bb247a408d2009c84ebe28365a92ee53e8b283d2cc5d6bb7c5126ff5cd8d",
    "97684c029da1e955674b78744ef14cdb3c350585ff3dc452bec81aa99b725936",
    "8ca613e19f6195c03b5532b3a86d19487068e988264bc6ce4e40c611e0978520",
    "0761223c1d5a070ac08a99f45fcb976d48eb6cab49dfaa795f88963ac8b091ed",
    "13faa13c24c87abc51f96f0053e9855e2212018a8de3ac6a4375e2c5fb929be3",
    "98a37cf1c80e24a9928554fe760af5176f924eed2b0a26df9e135dad8000503b",
    "1efd14e7e885ead4146d4cc55ddaa76e83f88d6453c70b68b8b7a4d4a5a050ce",
    "9a5c8c8320535aa9255a7dbe343ab7bf23e4b3cee45c792908b53ba5aa826b9a",
    "e03a9e30f930571f202c5b7944318fb895d909275788ef7908fc2f6a84f6b955",
    "016d216e5ca95b0ff9bd8c7f6dc5e680e226aec019905dff89b8ae0491002497",
    "9bce8bfde16c7b38a98926bb0bad7242775d71065b69715acc3230349bd44660",
    "eb69e16f78aa7eaf689d1f6cc44662d9b7032cfde8e976d208e1f049701ec0b4",
    "d34ac8b0465eb162f726d3a7cc36f317f6becd883422e04472c2110466fea709",
    "96bff32c86c49f104efc19560504f5097445cbd20f83b3b106e037e687510286",
    "4ef1cd4b1efb58f3e5f6a4ef2e85a49d87fe94e7870e43b2550e63f2a655cb9e",
    "c24ac033440ebb4ae6ab2ef614f48ec0a53b33aeaa7832e13f78ae0216f76cdc",
    "80e31e06244f59acb5007ad8fdd02c16834d3067df9fd5b42fd9cd3cc2236e1b",
    "b0ea9d498fa1c6acd2702562778efdc3f008c626dfae0df45d39c975ac5f76f6",
    "ccf99b533bf3ac097167e72b8c6cf067df5a96977f9087452962cf3dfa7d4de6",
    "72e334a54084381e86466566df0b01f366c9f8ab48494e4a9acf9bc90da92606",
    "bb3d0d933d53bfc077d84cb67a991a4112a4c96be8c1aac61e8a04e7f8370d40",
    "df2fc598532245738f4631c5ccf4fd62748b129a41e30be6909fd858fa7e3375",
    "29baa4ff15eb34c060d9d49457179f70a126e599d30ba6075b87e84e192309e4",
    "aea390666970ebe6b545997b036cdcc0efa2146e48f997be6074a100cd6d33de",
    "d37eb8c36e7a86e0cb414afabdd23d3865104dc7a233e0b0893e95cb2ac694f2",
    "ea9eca7866346a8dba99d1877d4c019c3305cd37056bc7884148dd927d996f38",
    "31a3f2632f2ae57761f171b4750a008de8fc423e2e54a6194877865f2d9e9a76",
    "ea180dec1ad5d1e52ffa2f1838a8551a59587b88e8831d71bef961cb7b0b5be8"
  ],
  "complete_candidate_relation_set_hash": "7d2b50ab9269c6f867925fa4f704ef7957e7a2685d68845638ac971d55a4aeca",
  "complete_candidate_universe_hash": "4ba44bae9b5dd5fdeda1cd988215d8a3f1e6d58d85e36e6c7710f917e79a1901",
  "execution_manifest_id": "9a76ac35974fe15fcac5031dff26576ed4fedd28bdbb4aece6302f8a7515b589",
  "historical_output_denylist_hash": "f2f48a3142bf192c08cfa2bffbb722e0131bfd4a1ba55623caf5af72748b94c7",
  "input_status": "FROZEN_PREPARATION_ONLY",
  "proposal_evidence_profile_hash": "e24746c96c5f741cc35df8d992d93936911dd1de2ce7f1a0f00035cda3b33deb",
  "proposal_input_bundle_id": "8dbda558d7029606afddfcdb4facdbf23d5ea7b01418390ec503ba3480dec656",
  "raw_identity_hash": "33af79bd98b6364bc6570b4e6031ff8b21f1fa537fbb09d0ab747813ce668cd6",
  "raw_key": "6000006::S04::A006",
  "raw_source_bundle_hash": "a80daf63d9573c3b6b923a9c4329b1039681720857beddd662a3ffbd5a097747",
  "schema": "PROPOSAL_INPUT_BUNDLE_CONTRACT_V1",
  "source_class_fact_type_registry_id": "8cef6206dfc3581c3e7b6358bde7a36e90f4ba99078176cc0e5aff4b238298a7"
}
